{
  "Gbyg4Yag10I": {
    "summarizedAt": "2025-10-22T13:58:30.505Z",
    "title": "Crypto Daily Update | 21/10/2025 - Confused Yet? Price seems to be!",
    "publishedAt": "2025-10-21T22:46:08Z",
    "section": "Daily Close Updates"
  },
  "EP2WZAAlQHM": {
    "summarizedAt": "2025-10-22T13:58:31.157Z",
    "title": "Crypto Daily Update | 19/10/2025 - Are Key Levels Getting Recovered?",
    "publishedAt": "2025-10-19T22:17:36Z",
    "section": "Daily Close Updates"
  },
  "CjgCwsycEdA": {
    "summarizedAt": "2025-10-22T13:58:31.604Z",
    "title": "Crypto Daily Update | 18/10/2025 - Key Levels for Today & Weekly Close",
    "publishedAt": "2025-10-18T22:17:58Z",
    "section": "Daily Close Updates"
  },
  "m_RgvFtoNsw": {
    "summarizedAt": "2025-10-22T13:58:32.139Z",
    "title": "Crypto Daily Update | 17/10/2025 - Is this fake? Big dump coming? SOL & BTC telling different Story",
    "publishedAt": "2025-10-17T20:34:01Z",
    "section": "Daily Close Updates"
  },
  "E_MBCJqwKWQ": {
    "summarizedAt": "2025-10-22T13:58:32.505Z",
    "title": "Crypto Daily Update | 16/10/2025 - Looking Bearish",
    "publishedAt": "2025-10-17T00:19:03Z",
    "section": "Daily Close Updates"
  },
  "FhTgDuogAIM": {
    "summarizedAt": "2025-10-22T13:58:32.900Z",
    "title": "Crypto Daily Update | 15/10/2025 - Even I'm Confused",
    "publishedAt": "2025-10-15T23:19:50Z",
    "section": "Daily Close Updates"
  },
  "cUuc0o0h65o": {
    "summarizedAt": "2025-10-22T13:58:33.476Z",
    "title": "Crypto Daily Update | 14/10/2025 - Can you trust this bounce yet?",
    "publishedAt": "2025-10-14T21:20:27Z",
    "section": "Daily Close Updates"
  },
  "kanw_VF-5zs": {
    "summarizedAt": "2025-10-22T13:58:33.944Z",
    "title": "Crypto Daily Update | 13/10/2025 - Showing how fast they can flip structure!",
    "publishedAt": "2025-10-13T22:28:23Z",
    "section": "Daily Close Updates"
  },
  "FRquQZMcCZM": {
    "summarizedAt": "2025-10-22T13:58:34.478Z",
    "title": "Crypto Daily Update | 12/10/2025 - Massive closes today. Key levels. Market looks primed.",
    "publishedAt": "2025-10-12T22:25:20Z",
    "section": "Daily Close Updates"
  },
  "YRnpJZzvpm0": {
    "summarizedAt": "2025-10-22T13:58:35.059Z",
    "title": "Crypto Daily Update | 11/10/2025 - Could we really pump from here? - $TSLA / $ADA By Request",
    "publishedAt": "2025-10-11T23:03:04Z",
    "section": "Daily Close Updates"
  },
  "M5DyH6pJRzc": {
    "summarizedAt": "2025-10-22T13:58:35.594Z",
    "title": "Basic TA - $ATOM - General TA advice for Spot Holders",
    "publishedAt": "2025-10-11T03:48:52Z",
    "section": "Shorts"
  },
  "kYAAsQey6rQ": {
    "summarizedAt": "2025-10-22T13:58:36.048Z",
    "title": "Crypto Daily Update - | 10/10/2025 - Prime Day Chaos",
    "publishedAt": "2025-10-10T22:49:14Z",
    "section": "Daily Close Updates"
  },
  "-cQPPnEcsQo": {
    "summarizedAt": "2025-10-22T13:58:36.523Z",
    "title": "Crypto Daily Update | 09/10/2025 - Should you be bearish or bullish?",
    "publishedAt": "2025-10-09T21:37:34Z",
    "section": "Daily Close Updates"
  },
  "xDPJelJ9VgQ": {
    "summarizedAt": "2025-10-22T13:58:37.221Z",
    "title": "Crypto Daily Update | 8/10/2025 - Minor flush yesterday, was that all?",
    "publishedAt": "2025-10-08T22:18:46Z",
    "section": "Daily Close Updates"
  },
  "p6cMNCphyv8": {
    "summarizedAt": "2025-10-22T13:58:37.552Z",
    "title": "Crypto Daily Update | 7/10/2025 - We need a last minute pump... or more dump coming!",
    "publishedAt": "2025-10-07T23:22:00Z",
    "section": "Daily Close Updates"
  },
  "AUoC5U4HRmI": {
    "summarizedAt": "2025-10-22T13:58:37.917Z",
    "title": "Crypto Daily Update | 6/10/2025 - Rotation Please....",
    "publishedAt": "2025-10-06T22:54:38Z",
    "section": "Daily Close Updates"
  },
  "uDbloU7OYJs": {
    "summarizedAt": "2025-10-22T13:58:38.907Z",
    "title": "Crypto Daily Update | 05/10/2025 - Is it time for BTC rotation or one more dip to come?",
    "publishedAt": "2025-10-05T21:45:17Z",
    "section": "Daily Close Updates"
  },
  "blesWnFypuk": {
    "summarizedAt": "2025-10-22T13:58:39.335Z",
    "title": "Crypto Daily Update | 04/10/2025 - Weekend Trap for Alts?",
    "publishedAt": "2025-10-04T22:27:35Z",
    "section": "Daily Close Updates"
  },
  "AIDc-YQEoSU": {
    "summarizedAt": "2025-10-22T13:58:39.770Z",
    "title": "Crypto Daily Update | 3/10/2025 - Should you be waiting for a pullback?",
    "publishedAt": "2025-10-03T22:41:01Z",
    "section": "Daily Close Updates"
  },
  "-xwRWHTApVQ": {
    "summarizedAt": "2025-10-22T13:58:40.407Z",
    "title": "Crypto Daily Update | 2/10/2025 - Pump, Pump & More Pump",
    "publishedAt": "2025-10-02T23:32:02Z",
    "section": "Daily Close Updates"
  },
  "99j3aHztqAA": {
    "summarizedAt": "2025-10-22T13:58:40.901Z",
    "title": "Crypto Daily Update | 01/10/2025 - The Squeeze - Now What?",
    "publishedAt": "2025-10-01T22:43:43Z",
    "section": "Daily Close Updates"
  },
  "muwx8kGfb5M": {
    "summarizedAt": "2025-10-22T13:58:41.307Z",
    "title": "Crypto Daily Update | 30/09/2025 - Why are they pulling back JUST before close? (AKA Scammy Pump?)",
    "publishedAt": "2025-09-30T23:30:07Z",
    "section": "Daily Close Updates"
  },
  "Hym2JF7S0m8": {
    "summarizedAt": "2025-10-22T13:58:41.971Z",
    "title": "Crypto Daily Update | 29/09/2025 - We got our pump.. Now what?",
    "publishedAt": "2025-09-29T22:13:43Z",
    "section": "Daily Close Updates"
  },
  "rOW3Ih-nIfs": {
    "summarizedAt": "2025-10-22T13:58:42.435Z",
    "title": "BTC - Nearly Dumped - Saved in the last moments #trading #liquidity #cryptodaily #bitcon",
    "publishedAt": "2025-09-29T05:34:33Z",
    "section": "Shorts"
  },
  "wWUl-D2Uajs": {
    "summarizedAt": "2025-10-22T13:58:43.057Z",
    "title": "Crypto Daily Update | 28/09/2025 - The Sunday PUMP!",
    "publishedAt": "2025-09-28T23:13:19Z",
    "section": "Daily Close Updates"
  },
  "v396t_nUY88": {
    "summarizedAt": "2025-10-22T13:58:43.427Z",
    "title": "Crypto Daily Update | 27/09/2025 - End of Week/Month Pump? Or More Dump?",
    "publishedAt": "2025-09-27T23:03:58Z",
    "section": "Daily Close Updates"
  },
  "ImbLJhq1KpY": {
    "summarizedAt": "2025-10-22T13:58:43.801Z",
    "title": "Education - Are we in a weekly Bear Market on SOL? - Origin Levels",
    "publishedAt": "2025-09-26T23:44:47Z",
    "section": "Education"
  },
  "TQGbvSQJZl4": {
    "summarizedAt": "2025-10-22T13:58:44.171Z",
    "title": "Crypto Daily Update | 26/09/2025 - Looking good!",
    "publishedAt": "2025-09-26T21:39:10Z",
    "section": "Daily Close Updates"
  },
  "HKq8Gb-iSIM": {
    "summarizedAt": "2025-10-22T13:58:44.597Z",
    "title": "Crypto Daily Update | 25/09/2025 - Ouch - There is blood in the markets and maybe more today.",
    "publishedAt": "2025-09-25T22:27:21Z",
    "section": "Daily Close Updates"
  },
  "7ZIwu5sH7AQ": {
    "summarizedAt": "2025-10-22T13:58:44.980Z",
    "title": "Crypto Daily Update | 24/09/2025 - This IS a correction, but is it over?",
    "publishedAt": "2025-09-24T22:58:00Z",
    "section": "Daily Close Updates"
  },
  "ULghsrVNaLM": {
    "summarizedAt": "2025-10-22T13:58:45.449Z",
    "title": "Crypto Daily Update | 23/09/2025 - Some signs of reversal appearing - One more sweep?",
    "publishedAt": "2025-09-23T22:59:43Z",
    "section": "Daily Close Updates"
  },
  "OfPSQDG0v_A": {
    "summarizedAt": "2025-10-22T13:58:45.798Z",
    "title": "Crypto Daily Update | 22/09/2025 - Same Again? Mixed signals on SOL - BTC Weak - Need a good close!",
    "publishedAt": "2025-09-22T21:49:02Z",
    "section": "Daily Close Updates"
  },
  "3kzWMUJfp10": {
    "summarizedAt": "2025-10-22T13:58:46.166Z",
    "title": "Crypto - Dump Update - By Request - We Knew This Was Coming Guys!",
    "publishedAt": "2025-09-22T08:54:31Z",
    "section": "Daily Close Updates"
  },
  "LuXTRj9kuXM": {
    "summarizedAt": "2025-10-22T13:58:46.793Z",
    "title": "Crypto Daily Update | 21/09/2025 - Charts Look like they want to dump, but if so, how far?",
    "publishedAt": "2025-09-21T22:48:18Z",
    "section": "Daily Close Updates"
  },
  "c9Nyy_P9EMo": {
    "summarizedAt": "2025-10-22T13:58:47.303Z",
    "title": "Education - TA By Request - $NOS - Nosana",
    "publishedAt": "2025-09-20T23:52:16Z",
    "section": "Education"
  },
  "Gzya-LvQFdw": {
    "summarizedAt": "2025-10-22T13:58:47.764Z",
    "title": "Crypto Daily Update | 20/09/2025 - Need a pump to save us!",
    "publishedAt": "2025-09-20T23:06:01Z",
    "section": "Daily Close Updates"
  },
  "QMLS-Cf8sQw": {
    "summarizedAt": "2025-10-22T13:58:48.267Z",
    "title": "Crypto Daily Update | 19/09/2025 - Pullback signs are there, but how low will it go?",
    "publishedAt": "2025-09-19T22:23:03Z",
    "section": "Daily Close Updates"
  },
  "Rw9PtweTzY8": {
    "summarizedAt": "2025-10-22T13:58:48.926Z",
    "title": "Crypto Daily Update | 18/09/2025 - Last 1D+ Hold Resistance on SOL.. What's next?",
    "publishedAt": "2025-09-18T23:25:57Z",
    "section": "Daily Close Updates"
  },
  "HSoSkYBnApo": {
    "summarizedAt": "2025-10-22T13:58:49.250Z",
    "title": "Crypto Daily Update | 17/09/2025 - FOMC - News - Noise - What Now?",
    "publishedAt": "2025-09-17T22:15:13Z",
    "section": "Daily Close Updates"
  },
  "C7I7F6iNQvI": {
    "summarizedAt": "2025-10-22T13:59:02.734Z",
    "title": "Crypto Daily Update | 16/09/2025 - News Inbound, HTF levels Hovering.",
    "publishedAt": "2025-09-16T22:57:15Z",
    "section": "Daily Close Updates"
  },
  "12rLTZBcf70": {
    "summarizedAt": "2025-10-23T03:08:10.200Z",
    "title": "Crypto Daily Update | 22/10/2025 - Are they brewing the next big dump? Or bounce before close?",
    "publishedAt": "2025-10-22T22:33:49Z",
    "section": "Daily Close Updates"
  },
  "lyb3Ee5kauU": {
    "summarizedAt": "2025-10-23T03:08:26.803Z",
    "title": "Crypto Daily Update | 15/09/2025 - Will you catch the next pump?",
    "publishedAt": "2025-09-15T23:15:48Z",
    "section": "Daily Close Updates"
  },
  "BUzZ7wYL2Qc": {
    "summarizedAt": "2025-10-23T03:08:41.711Z",
    "title": "Education - TA by Request - $SEI - Looks good for a move.",
    "publishedAt": "2025-09-14T23:45:41Z",
    "section": "Education"
  },
  "f2RalTqlPJ8": {
    "summarizedAt": "2025-10-23T03:08:56.767Z",
    "title": "Crypto Daily Update | 14/09/2025 - Will big players derisk?",
    "publishedAt": "2025-09-14T22:59:57Z",
    "section": "Daily Close Updates"
  },
  "8LaOuzVbLo4": {
    "summarizedAt": "2025-10-23T03:09:13.346Z",
    "title": "Education - By Request - HTF Charting of $TSLA - General Differences for Stocks.",
    "publishedAt": "2025-09-13T03:35:59Z",
    "section": "Education"
  },
  "CLo3EEe7Dbw": {
    "summarizedAt": "2025-10-23T03:09:29.728Z",
    "title": "Education - TA by Request - $TSLA - Future looks very bullish",
    "publishedAt": "2025-09-13T03:21:26Z",
    "section": "Education"
  },
  "9rlkYWN3TWo": {
    "summarizedAt": "2025-10-23T03:09:44.584Z",
    "title": "Education - TA by Request - $HYPE - So new, is it a trap? or just early?",
    "publishedAt": "2025-09-13T02:35:55Z",
    "section": "Education"
  },
  "ff4Km6KctBQ": {
    "summarizedAt": "2025-10-23T03:10:00.080Z",
    "title": "Education - By Request - TA on $EOS aka $A",
    "publishedAt": "2025-09-13T00:51:13Z",
    "section": "Education"
  },
  "Hlc8yLoqtbM": {
    "summarizedAt": "2025-10-23T03:10:15.825Z",
    "title": "Crypto Daily Update | 12/09/2025 - b00m - SOL taking off! The July 102D - $247 target explained",
    "publishedAt": "2025-09-12T22:44:01Z",
    "section": "Daily Close Updates"
  },
  "MwxfTHT-BTQ": {
    "summarizedAt": "2025-10-23T03:10:31.631Z",
    "title": "SOL to $1000 - Play it safe! #trading #liquidity #cryptodaily #Solana",
    "publishedAt": "2025-09-12T10:37:58Z",
    "section": "Shorts"
  },
  "RP6Bl1j9DD4": {
    "summarizedAt": "2025-10-23T03:10:39.693Z",
    "title": "Crypto Daily Update | 11/09/2025 - Does BTC want it's strength back?",
    "publishedAt": "2025-09-11T23:34:50Z",
    "section": "Daily Close Updates"
  },
  "8KlWLSJ5pXo": {
    "summarizedAt": "2025-10-23T03:10:47.821Z",
    "title": "#BTC - Right in the middle of the 1M channel, do we see $102k or $150k? Which one first?",
    "publishedAt": "2025-09-11T00:42:25Z",
    "section": "Shorts"
  },
  "fe2XcCzIkEQ": {
    "summarizedAt": "2025-10-23T03:10:56.274Z",
    "title": "Crypto Daily Update | 10/09/2025 - Price in a tricky spot.",
    "publishedAt": "2025-09-10T22:48:22Z",
    "section": "Daily Close Updates"
  },
  "ojmz-ajlnPc": {
    "summarizedAt": "2025-10-23T03:11:04.641Z",
    "title": "Education - A short Plan, Entering, Averaging, Managing. - By Request",
    "publishedAt": "2025-09-10T05:33:05Z",
    "section": "Education"
  },
  "xTl__X95QrU": {
    "summarizedAt": "2025-10-23T03:11:13.226Z",
    "title": "Crypto Daily Close Update | 09/09/2025 - SOL vs BTC - Crazy Times - Lots of closes today.",
    "publishedAt": "2025-09-09T23:02:20Z",
    "section": "Daily Close Updates"
  },
  "dLnEjhPSPbc": {
    "summarizedAt": "2025-10-23T03:11:21.731Z",
    "title": "Education - Refining Greedy Entries inside Hold Candles. Useful for better Risk Reward / Higher Lev",
    "publishedAt": "2025-09-08T23:22:04Z",
    "section": "Education"
  },
  "GLBUc5roBMk": {
    "summarizedAt": "2025-10-23T03:11:29.877Z",
    "title": "Crypto Daily Close Update | 08/09/2025 - Prime Day Part 1",
    "publishedAt": "2025-09-08T21:34:48Z",
    "section": "Daily Close Updates"
  },
  "wXHsdaN46hY": {
    "summarizedAt": "2025-10-23T03:11:38.794Z",
    "title": "Education - By Request - Leverage Trading - Why? - Should You?",
    "publishedAt": "2025-09-08T02:45:48Z",
    "section": "Education"
  },
  "21_2d0AQi9A": {
    "summarizedAt": "2025-10-23T03:11:47.271Z",
    "title": "Crypto Daily Close Update | 7/09/2025 - Long one - Lots to cover - BTC Should Give a big Move Soon.",
    "publishedAt": "2025-09-07T21:41:36Z",
    "section": "Daily Close Updates"
  },
  "oABs34tIOGc": {
    "summarizedAt": "2025-10-23T03:11:55.557Z",
    "title": "Education - (IMO) - Liquidity - What can you really tell from it and it's importance - By Request",
    "publishedAt": "2025-09-07T03:15:58Z",
    "section": "Education"
  },
  "nVPoWOlHtXU": {
    "summarizedAt": "2025-10-23T03:12:03.604Z",
    "title": "Crypto Daily Update | 06/09/2025 - Sunday Pump or Sunday Dump? (Or both!)",
    "publishedAt": "2025-09-06T22:24:27Z",
    "section": "Daily Close Updates"
  },
  "IuEZH56b0Dk": {
    "summarizedAt": "2025-10-23T03:12:12.367Z",
    "title": "Quick Update - Thoughts on the 3D close for tomorrow - More down? - Or recovery?",
    "publishedAt": "2025-09-06T02:32:21Z",
    "section": "Daily Close Updates"
  },
  "PFrfBG5nc_w": {
    "summarizedAt": "2025-10-23T03:12:20.781Z",
    "title": "Crypto Daily Update | 05/09/2025 - Another day on the cliff.",
    "publishedAt": "2025-09-05T22:54:17Z",
    "section": "Daily Close Updates"
  },
  "a1SZEXkPKYo": {
    "summarizedAt": "2025-10-23T03:12:29.667Z",
    "title": "Crypto Daily Update | 04/09/2025 - Market seems bored. Move soon.",
    "publishedAt": "2025-09-04T22:41:17Z",
    "section": "Daily Close Updates"
  },
  "BRinEOh_k4A": {
    "summarizedAt": "2025-10-23T03:12:38.553Z",
    "title": "Crypto Daily Close Update | 3/09/2025 - Calm.. Storm?",
    "publishedAt": "2025-09-03T22:51:27Z",
    "section": "Daily Close Updates"
  },
  "l2_aXap6cog": {
    "summarizedAt": "2025-10-23T03:12:46.576Z",
    "title": "Crypto Daily Close Update | 02/09/2025 - Is the bottom in?",
    "publishedAt": "2025-09-02T22:42:04Z",
    "section": "Daily Close Updates"
  },
  "BoJ2Px40bRU": {
    "summarizedAt": "2025-10-23T03:12:54.628Z",
    "title": "Education - By Request - 5min Scalping",
    "publishedAt": "2025-09-02T05:17:41Z",
    "section": "Education"
  },
  "OUdI9xCx3oU": {
    "summarizedAt": "2025-10-23T03:13:02.426Z",
    "title": "Education - Scalping Example - New Tokens $WLFI",
    "publishedAt": "2025-09-02T02:57:21Z",
    "section": "Shorts"
  },
  "inYpkBVe7TU": {
    "summarizedAt": "2025-10-23T03:13:11.221Z",
    "title": "Crypto Daily Close Update | 01/09/2025 - More Flush? Temp Bounce? Do they want 85k BTC?",
    "publishedAt": "2025-09-01T22:48:30Z",
    "section": "Daily Close Updates"
  },
  "88Rbd8G7ytA": {
    "summarizedAt": "2025-10-23T03:13:20.025Z",
    "title": "Crypto Daily Close Update | 31/08/2025 - Flush Soon",
    "publishedAt": "2025-08-31T23:13:18Z",
    "section": "Daily Close Updates"
  },
  "ykJQpj6X-K4": {
    "summarizedAt": "2025-10-23T03:13:27.900Z",
    "title": "Crypto Daily Close Update | 30/08/2025 - What are they building for?",
    "publishedAt": "2025-08-30T23:18:39Z",
    "section": "Daily Close Updates"
  },
  "kGLKktzHypY": {
    "summarizedAt": "2025-10-23T03:13:35.792Z",
    "title": "Education - My Tin Hat Theory - Prime Days - Elmo Chaos",
    "publishedAt": "2025-08-29T23:24:36Z",
    "section": "Education"
  },
  "vtu2PBFjewU": {
    "summarizedAt": "2025-10-23T03:13:44.365Z",
    "title": "Crypto Daily Close Update | 29/08/2025 - Prime Day Flush - Is it over?",
    "publishedAt": "2025-08-29T22:51:53Z",
    "section": "Daily Close Updates"
  },
  "r5bGg4SITkU": {
    "summarizedAt": "2025-10-23T03:13:52.517Z",
    "title": "SOL BTC Update | 28/08/2025 - Observations on all closes today.",
    "publishedAt": "2025-08-29T01:27:21Z",
    "section": "Daily Close Updates"
  },
  "z1HNYsntq84": {
    "summarizedAt": "2025-10-23T03:14:01.205Z",
    "title": "Crypto Daily Close Update | 28/08/2025 - Many Big Closes Today & Prime Day Tomorrow! - Chaos?",
    "publishedAt": "2025-08-28T22:22:56Z",
    "section": "Daily Close Updates"
  },
  "e_VlYkf_6RI": {
    "summarizedAt": "2025-10-23T03:14:08.840Z",
    "title": "Crypto Daily Close Update | 27/08/2025 - Prime Day 1D TV & 2D Exchange close",
    "publishedAt": "2025-08-27T22:18:25Z",
    "section": "Daily Close Updates"
  },
  "F_Opba5PE6s": {
    "summarizedAt": "2025-10-23T03:14:17.220Z",
    "title": "Education - Recap of Weekly/Daily trades this week by request",
    "publishedAt": "2025-08-27T05:51:48Z",
    "section": "Education"
  },
  "epmSojHqMzI": {
    "summarizedAt": "2025-10-23T03:14:25.514Z",
    "title": "SOL BTC Update | 26/08/2025 - Observations on the closes today",
    "publishedAt": "2025-08-27T02:30:43Z",
    "section": "Daily Close Updates"
  },
  "nX6hZjiCxUU": {
    "summarizedAt": "2025-10-23T03:14:33.531Z",
    "title": "Crypto Daily Close Update | 26/08/2025 - Bitcoin Crash? SOL Pump?",
    "publishedAt": "2025-08-26T22:33:50Z",
    "section": "Daily Close Updates"
  },
  "qmhKBUovO4Q": {
    "summarizedAt": "2025-10-23T03:14:42.449Z",
    "title": "SOL BTC Update | 24/08/2025 - Quick Observation of Close",
    "publishedAt": "2025-08-25T00:58:07Z",
    "section": "Daily Close Updates"
  },
  "zTe2NIHPvas": {
    "summarizedAt": "2025-10-24T03:04:03.461Z",
    "title": "Crypto Daily Update | Bullish Flip - Is it just another trap? or Will they close over key levels?",
    "publishedAt": "2025-10-23T20:56:03Z",
    "section": "Daily Close Updates"
  },
  "6dMxdUOi8IM": {
    "summarizedAt": "2025-10-24T03:04:04.335Z",
    "title": "SOL Update | 24/08/2025 - Hopium & Possible Trap - All rolled up in one!",
    "publishedAt": "2025-08-24T04:49:47Z",
    "section": "Shorts"
  },
  "rgOPNzqCeBE": {
    "summarizedAt": "2025-10-24T03:04:05.254Z",
    "title": "SOL BTC Update | 23/08/2025 - Quick Overview of how the 1D Closed",
    "publishedAt": "2025-08-24T00:25:34Z",
    "section": "Daily Close Updates"
  },
  "7thUJskh6wc": {
    "summarizedAt": "2025-10-24T03:04:06.190Z",
    "title": "SOL Update | 23/08/2025 - Is it time to open a swing trade?",
    "publishedAt": "2025-08-23T06:21:31Z",
    "section": "Shorts"
  },
  "AkbLexK-O8g": {
    "summarizedAt": "2025-10-24T03:04:07.230Z",
    "title": "SOL BTC Update - Observations of the close - 22/08/2025",
    "publishedAt": "2025-08-23T03:50:15Z",
    "section": "Daily Close Updates"
  },
  "Q_-rR0tkMTc": {
    "summarizedAt": "2025-10-24T03:04:08.311Z",
    "title": "Crypto Daily Close Update | 22/08/2025 - We pumped - Now Pullback?",
    "publishedAt": "2025-08-22T22:45:56Z",
    "section": "Daily Close Updates"
  },
  "sUABZC5k6P0": {
    "summarizedAt": "2025-10-24T03:04:09.259Z",
    "title": "Education - Concept of Cycle Trends & Realistic Reversal Points",
    "publishedAt": "2025-08-22T01:04:14Z",
    "section": "Education"
  },
  "xED_3vz7olM": {
    "summarizedAt": "2025-10-24T03:04:10.170Z",
    "title": "Education - Stop loss placement, trade TPs, Ideas around risk reward",
    "publishedAt": "2025-08-21T23:19:33Z",
    "section": "Education"
  },
  "MmiNxEK5vqI": {
    "summarizedAt": "2025-10-24T03:04:11.091Z",
    "title": "Crypto Daily Close Update | 21/08/2025 - Prime Day!",
    "publishedAt": "2025-08-21T22:24:41Z",
    "section": "Daily Close Updates"
  },
  "IbHZ9nAmOV8": {
    "summarizedAt": "2025-10-24T03:04:11.789Z",
    "title": "BTC / SOL - 4H Update - Prime Day - Levels & Thoughts so far",
    "publishedAt": "2025-08-21T04:14:47Z",
    "section": "Shorts"
  },
  "7v2AXLkkG4A": {
    "summarizedAt": "2025-10-24T03:04:12.644Z",
    "title": "SOL 8D Close - Bullish - Will We Get A Dip to Buy? #trading #liquidity #cryptodaily #solana",
    "publishedAt": "2025-08-21T00:14:37Z",
    "section": "Shorts"
  },
  "k5f121SpRfg": {
    "summarizedAt": "2025-10-24T03:04:13.598Z",
    "title": "Crypto Daily Close Update | 20/08/2025 - SOL Strong, BTC Weak - Do we buy the dip?",
    "publishedAt": "2025-08-20T22:55:11Z",
    "section": "Daily Close Updates"
  },
  "fJKDE-kC9sE": {
    "summarizedAt": "2025-10-24T03:04:14.256Z",
    "title": "Sound Bite - Shout out to Chris in Fib Lab - Diggling My Frustrations!",
    "publishedAt": "2025-08-20T10:55:21Z",
    "section": "Shorts"
  },
  "e3WbsUlY2VI": {
    "summarizedAt": "2025-10-24T03:04:15.096Z",
    "title": "Education - Weekend Day Trading - By Request - Crypto Tips & Tricks",
    "publishedAt": "2025-08-20T03:32:04Z",
    "section": "Education"
  },
  "4PNY1eumgiQ": {
    "summarizedAt": "2025-10-24T03:04:15.835Z",
    "title": "BTC - Big players buying the liquidations? - Wen Pump? #trading #liquidity #cryptodaily",
    "publishedAt": "2025-08-20T00:19:08Z",
    "section": "Shorts"
  },
  "tZnNZ1ZCKyY": {
    "summarizedAt": "2025-10-24T03:04:16.771Z",
    "title": "Crypto Daily Close Update 19/08/2025 - End signs for Dump, Or more pain?",
    "publishedAt": "2025-08-19T23:14:55Z",
    "section": "Daily Close Updates"
  },
  "Us_GyuDI1gk": {
    "summarizedAt": "2025-10-24T03:04:17.478Z",
    "title": "DOGE Coin - Monthly / Weekly / Quick Daily Look",
    "publishedAt": "2025-08-19T16:10:46Z",
    "section": "Shorts"
  },
  "WrwDCmtN8_0": {
    "summarizedAt": "2025-10-24T03:04:18.298Z",
    "title": "Markets invite you in, then decide what they want to take! #trading #liquidity #cryptodaily",
    "publishedAt": "2025-08-19T14:50:57Z",
    "section": "Shorts"
  },
  "iQNPhZnTh64": {
    "summarizedAt": "2025-10-24T03:04:18.842Z",
    "title": "110k BTC, Why the delay? #trading #cryptodaily #cryptocurrency #liquidity ##cryptomedia #crypto",
    "publishedAt": "2025-08-19T02:54:54Z",
    "section": "Shorts"
  },
  "Ba9qqd0-u7M": {
    "summarizedAt": "2025-10-24T03:04:19.510Z",
    "title": "SOL Close | 18/08/2025 - Quick Speed Update",
    "publishedAt": "2025-08-19T00:11:32Z",
    "section": "Shorts"
  },
  "Y9VjCdoQ8as": {
    "summarizedAt": "2025-10-24T03:04:20.294Z",
    "title": "Crypto Daily Close Update | 18/08/2025 - Will We Get Dump Day #2 ?",
    "publishedAt": "2025-08-18T23:05:38Z",
    "section": "Daily Close Updates"
  },
  "-pHdyL1VlUY": {
    "summarizedAt": "2025-10-24T03:04:20.978Z",
    "title": "SOL - The Big Dump! - Levels I'm watching",
    "publishedAt": "2025-08-18T07:34:35Z",
    "section": "Shorts"
  },
  "UQvui8qlNzs": {
    "summarizedAt": "2025-10-24T03:04:21.853Z",
    "title": "SOL / BTC Quick Close Update | 17/08/2025",
    "publishedAt": "2025-08-18T00:14:36Z",
    "section": "Shorts"
  },
  "bATL6S0Fgxc": {
    "summarizedAt": "2025-10-24T03:04:22.599Z",
    "title": "Crypto Daily Close Update | 17/08/2025 - The Big Multi-Week Closes are TODAY!",
    "publishedAt": "2025-08-17T22:25:34Z",
    "section": "Daily Close Updates"
  },
  "gIRTJi71UN0": {
    "summarizedAt": "2025-10-24T03:04:23.084Z",
    "title": "SOL - First 2D Scalp From Todays Close - Win",
    "publishedAt": "2025-08-17T03:21:44Z",
    "section": "Shorts"
  },
  "MbPKHrxKwuk": {
    "summarizedAt": "2025-10-24T03:04:23.723Z",
    "title": "BTC / SOL - Quick Close Update",
    "publishedAt": "2025-08-17T00:13:28Z",
    "section": "Shorts"
  },
  "I1H08WyN9Gk": {
    "summarizedAt": "2025-10-24T03:04:24.553Z",
    "title": "Crypto Daily Close Update | 16/08/2025 - BTC Dump? - SOL might be forced to follow.",
    "publishedAt": "2025-08-16T22:50:35Z",
    "section": "Daily Close Updates"
  },
  "2bx2eAIps9s": {
    "summarizedAt": "2025-10-24T03:04:25.312Z",
    "title": "Education - Support/Resistance/Holds/Trends/Range Trends/Breaks/Origins/Cycles - Solana",
    "publishedAt": "2025-08-16T01:35:24Z",
    "section": "Education"
  },
  "xl3MMN2pOco": {
    "summarizedAt": "2025-10-24T03:04:26.052Z",
    "title": "Crypto Daily Close Update 15/08/2025 - A slow prime day? What are they planning?",
    "publishedAt": "2025-08-15T23:07:30Z",
    "section": "Daily Close Updates"
  },
  "YqQgmp6SSic": {
    "summarizedAt": "2025-10-24T03:04:26.889Z",
    "title": "Concept - Origin Levels aka Breakout Levels aka Break Level Origins",
    "publishedAt": "2025-08-14T23:02:47Z",
    "section": "Education"
  },
  "QmsY9Lbjy-I": {
    "summarizedAt": "2025-10-24T03:04:27.753Z",
    "title": "Crypto Daily Close Update | 14/08/2025 - Flush + Prime Day Tomorrow - Maybe a top for BTC?",
    "publishedAt": "2025-08-14T22:47:19Z",
    "section": "Daily Close Updates"
  },
  "t8EDt0NhJaI": {
    "summarizedAt": "2025-10-24T03:04:28.399Z",
    "title": "Crypto Daily Close Update | 13/08/2025 - Bullish Looking Charts - But is it a Trap?",
    "publishedAt": "2025-08-13T23:43:31Z",
    "section": "Daily Close Updates"
  },
  "mVEOgDYmVEs": {
    "summarizedAt": "2025-10-24T03:04:29.220Z",
    "title": "Crypto Daily Close Update | 12/08/2025 - BTC Down, SOL Up, Alt Season Finally? - Or another trap?",
    "publishedAt": "2025-08-12T23:03:39Z",
    "section": "Daily Close Updates"
  },
  "dJVIDNvyr3w": {
    "summarizedAt": "2025-10-24T03:04:29.961Z",
    "title": "Education - Examples of Fib Hold Candle Trading",
    "publishedAt": "2025-08-12T06:39:46Z",
    "section": "Education"
  },
  "daml8YKSlzI": {
    "summarizedAt": "2025-10-24T03:04:30.692Z",
    "title": "Crypto Daily Close Update | 11/08/2025 - Happy Prime Day!",
    "publishedAt": "2025-08-11T23:03:48Z",
    "section": "Daily Close Updates"
  },
  "byZyllak59M": {
    "summarizedAt": "2025-10-24T03:04:31.330Z",
    "title": "Education - SOL on the 37D from 2021 till now - How price moves.",
    "publishedAt": "2025-08-10T23:49:52Z",
    "section": "Education"
  },
  "EsVIZa01bOs": {
    "summarizedAt": "2025-10-24T03:04:32.158Z",
    "title": "Crypto Daily Close Update | 10/08/2025 - Also Weekly Close",
    "publishedAt": "2025-08-10T23:00:22Z",
    "section": "Daily Close Updates"
  },
  "lbMdEDn_oQc": {
    "summarizedAt": "2025-10-24T03:04:32.719Z",
    "title": "Crypto Daily Close Update | 09/08/2025 - HTF still in play. Possible rejection into next week.",
    "publishedAt": "2025-08-09T23:24:57Z",
    "section": "Daily Close Updates"
  },
  "BXLgIWPKID4": {
    "summarizedAt": "2025-10-24T03:04:33.482Z",
    "title": "Crypto Daily Close Update | 08/08/2025",
    "publishedAt": "2025-08-08T23:40:23Z",
    "section": "Daily Close Updates"
  },
  "Rliidceo3rA": {
    "summarizedAt": "2025-10-24T03:04:34.060Z",
    "title": "SOL Update - Nice Close - Some targets Hit - Possible Trap for Weekend",
    "publishedAt": "2025-08-08T02:48:18Z",
    "section": "Shorts"
  },
  "pZ7XV8UYn8E": {
    "summarizedAt": "2025-10-25T03:06:57.068Z",
    "title": "Crypto Daily Update | 24/10/2025 - Can we keep reclaiming levels or will the HTF trap kick in?",
    "publishedAt": "2025-10-24T22:01:19Z",
    "section": "Daily Close Updates"
  },
  "lo71-IfbBvQ": {
    "summarizedAt": "2025-10-25T03:06:57.845Z",
    "title": "Crypto Daily Close Update | 07/08/2025",
    "publishedAt": "2025-08-07T22:13:46Z",
    "section": "Daily Close Updates"
  },
  "RWieY2Z2JzQ": {
    "summarizedAt": "2025-10-25T03:06:58.577Z",
    "title": "Concept - Range Trends vs Normal Trend, How to trade the break out.",
    "publishedAt": "2025-08-07T01:44:49Z",
    "section": "Education"
  },
  "Utr66b4azt0": {
    "summarizedAt": "2025-10-25T03:06:59.427Z",
    "title": "Crypto Daily Close Update | 06/08/2025",
    "publishedAt": "2025-08-06T22:32:39Z",
    "section": "Daily Close Updates"
  },
  "fHa-5BkRBco": {
    "summarizedAt": "2025-10-25T03:07:00.158Z",
    "title": "Crypto Daily Close Update | 05/08/2025",
    "publishedAt": "2025-08-05T23:00:09Z",
    "section": "Daily Close Updates"
  },
  "vcEEF_e1uhg": {
    "summarizedAt": "2025-10-25T03:07:00.948Z",
    "title": "Crypto Daily Close Update | 04/08/2025",
    "publishedAt": "2025-08-04T23:27:20Z",
    "section": "Daily Close Updates"
  },
  "ILD7GgVLpK8": {
    "summarizedAt": "2025-10-25T03:07:01.783Z",
    "title": "SOL / BTC - 4H Update",
    "publishedAt": "2025-08-04T04:35:36Z",
    "section": "Shorts"
  },
  "B36ftEbX_xQ": {
    "summarizedAt": "2025-10-25T03:07:02.499Z",
    "title": "Concepts - TradingView based Liquidation Level Indicators",
    "publishedAt": "2025-08-04T03:58:49Z",
    "section": "Education"
  },
  "JN1VvAvwdRg": {
    "summarizedAt": "2025-10-25T03:07:03.303Z",
    "title": "Crypto Daily Close Update | 3/08/2025 - Also Weekly Closes Today",
    "publishedAt": "2025-08-03T22:39:00Z",
    "section": "Daily Close Updates"
  },
  "MSnhhzlNkPU": {
    "summarizedAt": "2025-10-25T03:07:04.071Z",
    "title": "SOL / BTC / Liquidity Quick Update",
    "publishedAt": "2025-08-03T04:46:21Z",
    "section": "Shorts"
  },
  "3zLts-g0a5Q": {
    "summarizedAt": "2025-10-25T03:07:04.883Z",
    "title": "Concepts - Time Arrayed Trend & Trend Scalping - Easy Money",
    "publishedAt": "2025-08-02T00:41:49Z",
    "section": "Education"
  },
  "4odvd853L94": {
    "summarizedAt": "2025-10-25T03:07:05.672Z",
    "title": "Crypto Daily Close Update 1/08/2025 - Dump Day!",
    "publishedAt": "2025-08-01T23:03:35Z",
    "section": "Daily Close Updates"
  },
  "20Q0MfWZ_-A": {
    "summarizedAt": "2025-10-25T03:07:06.503Z",
    "title": "SOL / ETH Update - Got the Dump Entries - Looking at Targets",
    "publishedAt": "2025-08-01T03:29:52Z",
    "section": "Shorts"
  },
  "GqwoccFxAgk": {
    "summarizedAt": "2025-10-25T03:07:07.325Z",
    "title": "Crypto Daily Close Update | 31/07/2025 - Monthly Close",
    "publishedAt": "2025-07-31T23:15:15Z",
    "section": "Daily Close Updates"
  },
  "sTMSAC5oyDI": {
    "summarizedAt": "2025-10-25T03:07:08.063Z",
    "title": "SOL Update - 4H update - Looking ahead to Monthly Close",
    "publishedAt": "2025-07-31T04:50:39Z",
    "section": "Shorts"
  },
  "lMyMxceTq4g": {
    "summarizedAt": "2025-10-25T03:07:08.647Z",
    "title": "SOL Update - Daily Closed back up into range. & 12H Also",
    "publishedAt": "2025-07-31T00:11:46Z",
    "section": "Shorts"
  },
  "UG4OkXywvms": {
    "summarizedAt": "2025-10-25T03:07:09.224Z",
    "title": "Crypto Daily Close Update | 30/07/2025 - Happy Prime Day!",
    "publishedAt": "2025-07-30T22:06:52Z",
    "section": "Daily Close Updates"
  },
  "9h6LvlosjD4": {
    "summarizedAt": "2025-10-25T03:07:09.993Z",
    "title": "SOL Update - Some support / Target levels for short term moves.",
    "publishedAt": "2025-07-30T03:44:58Z",
    "section": "Shorts"
  },
  "pSsHWO91-L4": {
    "summarizedAt": "2025-10-25T03:07:10.751Z",
    "title": "Crypto Daily Close Update | 29/07/2025 - Big moves ahead!",
    "publishedAt": "2025-07-29T23:25:58Z",
    "section": "Daily Close Updates"
  },
  "e2pRRbIaeUw": {
    "summarizedAt": "2025-10-25T03:07:11.331Z",
    "title": "Morning Clarity - 23D Solana Timeframe + Liquidity Target",
    "publishedAt": "2025-07-29T20:01:57Z",
    "section": "Shorts"
  },
  "eK2DhBN5QyA": {
    "summarizedAt": "2025-10-25T03:07:12.053Z",
    "title": "SOL - Pure TA based ATH Prediction & Proof of concept based on price action",
    "publishedAt": "2025-07-29T08:44:48Z",
    "section": "Education"
  },
  "5mz9-ccGzcw": {
    "summarizedAt": "2025-10-25T03:07:12.645Z",
    "title": "SOL Update - May have landed a weekly level",
    "publishedAt": "2025-07-29T03:16:43Z",
    "section": "Shorts"
  },
  "l6eiDwSeCOw": {
    "summarizedAt": "2025-10-25T03:07:13.170Z",
    "title": "Crypto Daily Close Update | 28/07/2025",
    "publishedAt": "2025-07-28T23:11:33Z",
    "section": "Daily Close Updates"
  },
  "je9gooc5nyw": {
    "summarizedAt": "2025-10-25T03:07:13.802Z",
    "title": "SOL Update 4H since Close",
    "publishedAt": "2025-07-28T03:52:08Z",
    "section": "Daily Close Updates"
  },
  "5VPMGb1i9xc": {
    "summarizedAt": "2025-10-25T03:07:14.530Z",
    "title": "Crypto Daily Close Update | 27/07/2025",
    "publishedAt": "2025-07-27T23:49:20Z",
    "section": "Daily Close Updates"
  },
  "yoie9HanzvM": {
    "summarizedAt": "2025-10-25T03:07:15.279Z",
    "title": "BTC & SOL Update 4H since Close",
    "publishedAt": "2025-07-27T03:59:06Z",
    "section": "Shorts"
  },
  "Jamwo-OnIIQ": {
    "summarizedAt": "2025-10-25T03:07:15.901Z",
    "title": "Concepts - Standard Topside & Bottom side Trends",
    "publishedAt": "2025-07-27T03:18:06Z",
    "section": "Education"
  },
  "RjIdRwpJW44": {
    "summarizedAt": "2025-10-25T03:07:16.619Z",
    "title": "Concepts - Hold & Break Levels",
    "publishedAt": "2025-07-27T02:55:43Z",
    "section": "Education"
  },
  "vqbsy_QjshM": {
    "summarizedAt": "2025-10-25T03:07:17.360Z",
    "title": "Crypto Daily Close Update | 26/07/2025",
    "publishedAt": "2025-07-27T00:08:37Z",
    "section": "Daily Close Updates"
  },
  "CrjKXAGSlt8": {
    "summarizedAt": "2025-10-26T03:18:11.485Z",
    "title": "Crypto Daily Update | Looking Ahead To Major Weekly Closes",
    "publishedAt": "2025-10-25T20:42:30Z",
    "section": "Daily Close Updates"
  },
  "ssSOtSRR6CQ": {
    "summarizedAt": "2025-10-27T03:23:33.260Z",
    "title": "Crypto Daily Close | 26/10/2025 - Key Levels - Will they reverse the weekend pump?",
    "publishedAt": "2025-10-26T21:23:19Z",
    "section": "Daily Close Updates"
  },
  "e4Lbz_3Vk9Y": {
    "summarizedAt": "2025-10-28T03:11:52.910Z",
    "title": "Crypto Daily Update - Low timeframe trying to recover, high timeframe setting a trap.",
    "publishedAt": "2025-10-27T22:03:56Z",
    "section": "Daily Close Updates"
  },
  "IqyIAW79QoM": {
    "summarizedAt": "2025-10-29T03:20:06.980Z",
    "title": "Crypto Daily Candle Close | Smart Money Setting a Trap Tonight?",
    "publishedAt": "2025-10-28T21:34:33Z",
    "section": "Daily Close Updates"
  },
  "WlWUvOLwI7Q": {
    "summarizedAt": "2025-10-30T03:15:29.712Z",
    "title": "Bitcoin Daily Chart Analysis | Smart Money Levels to Watch Tonight",
    "publishedAt": "2025-10-29T19:43:16Z",
    "section": "Daily Close Updates"
  },
  "XbgwSbJjz7o": {
    "summarizedAt": "2025-10-31T03:16:05.651Z",
    "title": "Crypto Daily Update - Will Big Money Step In To Save The Monthly?",
    "publishedAt": "2025-10-30T22:13:13Z",
    "section": "Daily Close Updates"
  },
  "xd0JNfuX6cg": {
    "summarizedAt": "2025-11-01T03:15:47.323Z",
    "title": "Crypto Daily Update - Big BTC Crash, Blow Off Top, Or New Range?",
    "publishedAt": "2025-10-31T21:58:53Z",
    "section": "Daily Close Updates"
  },
  "MCfb0Xl6zWo": {
    "summarizedAt": "2025-11-02T03:20:51.089Z",
    "title": "Crypto Daily Update - Will We Break Today? SUNDAY PUMP!!!",
    "publishedAt": "2025-11-01T20:09:45Z",
    "section": "Daily Close Updates"
  },
  "fUyMTgV41so": {
    "summarizedAt": "2025-11-03T03:22:52.723Z",
    "title": "Crypto Daily Update - Charts are telling us a dump is coming. Will they pump it first?",
    "publishedAt": "2025-11-02T21:25:00Z",
    "section": "Daily Close Updates"
  },
  "32n76jtR7qc": {
    "summarizedAt": "2025-11-04T03:15:41.361Z",
    "title": "Crypto Daily Update - Is the Dump Over?",
    "publishedAt": "2025-11-03T23:27:51Z",
    "section": "Daily Close Updates"
  },
  "NSq6Sa-HK8I": {
    "summarizedAt": "2025-11-05T03:15:45.232Z",
    "title": "Crypto Daily Update | Will The Bounce Ever Come? - Key Levels",
    "publishedAt": "2025-11-04T21:59:56Z",
    "section": "Daily Close Updates"
  },
  "FTWw4AOtQTs": {
    "summarizedAt": "2025-11-06T03:19:05.001Z",
    "title": "Crypto Daily Update - Key Levels You MUST Know Just Incase There Is A Trap!",
    "publishedAt": "2025-11-05T23:00:58Z",
    "section": "Daily Close Updates"
  },
  "uEwzKT8DqME": {
    "summarizedAt": "2025-11-07T03:17:18.075Z",
    "title": "Crypto Daily Update - Will BTC Liquidate 100-90K Area Or Are Too Many People expecting?",
    "publishedAt": "2025-11-06T21:26:51Z",
    "section": "Daily Close Updates"
  },
  "Gt77KUEB3WQ": {
    "summarizedAt": "2025-11-08T03:06:31.937Z",
    "title": "Crypto Daily Update -Secrets of Future Range Creation Revealed - You REALLY Want To See This One!",
    "publishedAt": "2025-11-07T21:52:31Z",
    "section": "Daily Close Updates"
  },
  "rGF7em5eIu4": {
    "summarizedAt": "2025-11-09T03:17:31.457Z",
    "title": "Crypto Daily Update - SOL Bullish - BTC Bearish - Does BTC Need One More Dump?",
    "publishedAt": "2025-11-08T22:27:30Z",
    "section": "Daily Close Updates"
  },
  "_wWMx-1toGE": {
    "summarizedAt": "2025-11-10T03:23:26.287Z",
    "title": "Crypto Daily Update - MASSIVE 22W Range Close Today - 2nd Time Ever. What Will Happen?",
    "publishedAt": "2025-11-09T22:03:42Z",
    "section": "Daily Close Updates"
  },
  "CmCvwMdOpj4": {
    "summarizedAt": "2025-11-11T03:17:26.901Z",
    "title": "Crypto Daily Update - Somethings Wrong With Bitcoin - Totals Bullish - Bitcoin Sneaky or Bearish?",
    "publishedAt": "2025-11-10T21:26:27Z",
    "section": "Daily Close Updates"
  },
  "X472X2hFD0I": {
    "summarizedAt": "2025-11-12T03:16:35.975Z",
    "title": "Crypto Daily Update - Will $BTC Hold 100k or Another Dump Brewing?",
    "publishedAt": "2025-11-11T22:47:41Z",
    "section": "Daily Close Updates"
  },
  "JBG2ezco9RE": {
    "summarizedAt": "2025-11-13T03:19:09.880Z",
    "title": "Crypto Daily Update - Crypto Market Holding On JUST - Signs Not Good Though!",
    "publishedAt": "2025-11-12T22:50:21Z",
    "section": "Daily Close Updates"
  },
  "vSLArgOg1FI": {
    "summarizedAt": "2025-11-14T03:16:48.423Z",
    "title": "Crypto Daily Update - Will This Bounce Last or is BTC Being Sneaky?",
    "publishedAt": "2025-11-13T23:35:17Z",
    "section": "Daily Close Updates"
  },
  "F63S8hwGys0": {
    "summarizedAt": "2025-11-15T03:10:54.741Z",
    "title": "Crypto Daily Update - BTC Still Looks Bad - But Some Positive Signs On SOL?",
    "publishedAt": "2025-11-14T20:41:34Z",
    "section": "Daily Close Updates"
  },
  "ddxWmudEhmQ": {
    "summarizedAt": "2025-11-16T03:22:07.641Z",
    "title": "Crypto Daily Update - Incoming Rally? Or Just More Down? Alts Say Up, BTC Says  Down!",
    "publishedAt": "2025-11-15T23:32:01Z",
    "section": "Daily Close Updates"
  },
  "hNV-s7GZNKg": {
    "summarizedAt": "2025-11-17T03:20:34.453Z",
    "title": "Crypto Daily Update - It's Make Or Break Time For $BTC",
    "publishedAt": "2025-11-16T22:46:10Z",
    "section": "Daily Close Updates"
  },
  "Ab4QZTCkcoI": {
    "summarizedAt": "2025-11-18T03:16:26.755Z",
    "title": "Crypto Daily Update - Charts Look Very Bearish! Shout Out To DannyZ!",
    "publishedAt": "2025-11-17T23:19:02Z",
    "section": "Daily Close Updates"
  },
  "Gbkfketh3xo": {
    "summarizedAt": "2025-11-19T03:15:40.278Z",
    "title": "Crypto Daily Update - Reversal Signs Are Here - All Key Levels For SOL & BTC",
    "publishedAt": "2025-11-18T22:29:25Z",
    "section": "Daily Close Updates"
  },
  "0lkXPA6v_H8": {
    "summarizedAt": "2025-11-20T03:14:03.588Z",
    "title": "Crypto Daily Update - Has BTC Finally Found Support? - Or Another Fake Bounce and More Pain to Come?",
    "publishedAt": "2025-11-19T23:34:09Z",
    "section": "Daily Close Updates"
  },
  "A2esVkVSXiE": {
    "summarizedAt": "2025-11-21T03:14:47.096Z",
    "title": "Crypto Daily Update - NY Dumping Whales Keep Pumping - Will Any Reversal Hold Or Is This The Bear?",
    "publishedAt": "2025-11-20T22:44:16Z",
    "section": "Daily Close Updates"
  },
  "Ho3npH97aKk": {
    "summarizedAt": "2025-11-22T03:08:19.122Z",
    "title": "Crypto Daily Update - BTC - Has The Support Been Found? - Is there a TRAP for Alts?",
    "publishedAt": "2025-11-21T22:09:24Z",
    "section": "Daily Close Updates"
  },
  "TfOIlJoNWGw": {
    "summarizedAt": "2025-11-22T03:08:28.548Z",
    "title": "Quick Trend $TSLA - 4M - 1M Time arrayed to find precise rejection.",
    "publishedAt": "2025-11-21T20:14:26Z",
    "section": "Education"
  },
  "HMUBACya3M8": {
    "summarizedAt": "2025-11-23T03:39:21.101Z",
    "title": "Crypto Daily Update - Unprecedented Times For BTC Structure - Massive Wallet Moves In Play",
    "publishedAt": "2025-11-22T21:59:21Z",
    "section": "Daily Close Updates"
  },
  "k2WHPl_T7R8": {
    "summarizedAt": "2025-11-24T03:28:25.895Z",
    "title": "Crypto Daily Update - Bullish Signs or Fake Sunday Pump?",
    "publishedAt": "2025-11-23T21:09:37Z",
    "section": "Daily Close Updates"
  },
  "ROT8hKpKhbw": {
    "summarizedAt": "2025-11-25T03:19:18.166Z",
    "title": "Crypto Daily Update - Will The Pump Continue? - All The Key Levels I'm Watching Now.",
    "publishedAt": "2025-11-24T21:27:48Z",
    "section": "Daily Close Updates"
  },
  "E9zhYcYOXVY": {
    "summarizedAt": "2025-11-26T03:19:00.610Z",
    "title": "Crypto Daily Update - Bitcoin Turned On Boring Mode - Calm Before The Storm?",
    "publishedAt": "2025-11-25T22:56:50Z",
    "section": "Daily Close Updates"
  },
  "HPGbr0VoIWI": {
    "summarizedAt": "2025-11-27T03:15:19.061Z",
    "title": "Crypto Daily Update - Major Closes Today - Prime Day Tomorrow - What Could Possibly Go Wrong???",
    "publishedAt": "2025-11-26T21:23:50Z",
    "section": "Daily Close Updates"
  },
  "d7k24cr57cw": {
    "summarizedAt": "2025-12-01T03:54:37.417Z",
    "title": "Crypto Daily Update - When Will The Tight Range Break? - BTC & SOL Both On Pause.",
    "publishedAt": "2025-11-30T20:53:34Z",
    "section": "Daily Close Updates"
  },
  "IVtRKQtneyQ": {
    "summarizedAt": "2025-12-02T03:22:51.861Z",
    "title": "Crypto Daily Update - Could $SOL hit $14? - Will We Get Any Relief Rally in 2025? - Cold Hard Truths",
    "publishedAt": "2025-12-01T21:21:52Z",
    "section": "Daily Close Updates"
  },
  "mzeG7yK1WhM": {
    "summarizedAt": "2025-12-03T03:21:25.676Z",
    "title": "Crypto Daily Update - $SOL $BTC - $TSLA & $MSTR Deeper Dives - Today and December Are Make or Break!",
    "publishedAt": "2025-12-02T23:09:29Z",
    "section": "Daily Close Updates"
  },
  "0x8eml6An4c": {
    "summarizedAt": "2025-12-04T03:23:55.040Z",
    "title": "Crypto Daily Update - $BTC & $SOL - BULLISH Short Squeeze! - BUT Will We Get Continuation?",
    "publishedAt": "2025-12-03T20:37:55Z",
    "section": "Daily Close Updates"
  },
  "yCO4YoJqsqI": {
    "summarizedAt": "2025-12-05T03:23:19.291Z",
    "title": "Crypto Daily Update - BTC & SOL Bearish & Bullish Targets - BUT Which Way First?",
    "publishedAt": "2025-12-04T21:42:00Z",
    "section": "Daily Close Updates"
  },
  "9AM9bhXxNKE": {
    "summarizedAt": "2025-12-06T03:13:44.854Z",
    "title": "Crypto Daily Update - Bearish Closes Today, Or Will Whales Save The Day? Is the CME taking Over?",
    "publishedAt": "2025-12-05T22:17:03Z",
    "section": "Daily Close Updates"
  },
  "IdsmA7d4PNE": {
    "summarizedAt": "2025-12-07T03:39:24.598Z",
    "title": "Crypto Daily Update - Dump? Pump? Price Seems Stuck - Do We Need FOMC To #FreeTheCandle",
    "publishedAt": "2025-12-06T21:59:11Z",
    "section": "Daily Close Updates"
  },
  "efGdYhr1ZFM": {
    "summarizedAt": "2025-12-08T03:25:47.264Z",
    "title": "Crypto Daily Update  - Big Multi Week Closes - Pump Now Or New Low Targets Created. (No TSLA/MSTR)",
    "publishedAt": "2025-12-07T22:54:42Z",
    "section": "Daily Close Updates"
  },
  "gR4RBhl08TM": {
    "summarizedAt": "2025-12-09T03:22:57.121Z",
    "title": "Crypto Daily Update - This Time Is Different - $BTC and $SOL - Trying to Trap Both Longs & Shorts?",
    "publishedAt": "2025-12-08T22:12:42Z",
    "section": "Daily Close Updates"
  },
  "Gz6r3lIHFTM": {
    "summarizedAt": "2025-12-10T03:26:43.444Z",
    "title": "Crypto Daily Update - Price is Hitting Key Breakout Levels - But Can it Hold or Is it a Trap?",
    "publishedAt": "2025-12-09T21:59:36Z",
    "section": "Daily Close Updates"
  },
  "TtUSNrGV2oQ": {
    "summarizedAt": "2025-12-11T03:37:43.407Z",
    "title": "Crypto Daily Update - FOMC PUMPED - Can We Hold The Key Levels?",
    "publishedAt": "2025-12-10T20:26:39Z",
    "section": "Daily Close Updates"
  },
  "EZHKW7yAdEI": {
    "summarizedAt": "2025-12-12T03:27:53.183Z",
    "title": "Crypto Daily Update - Is Today The Day? BTC Breakout or Just Another Fake Out Before Close?",
    "publishedAt": "2025-12-11T21:51:51Z",
    "section": "Daily Close Updates"
  },
  "MmOO61YFD1U": {
    "summarizedAt": "2025-12-13T03:19:53.770Z",
    "title": "Crypto Daily Update - Free The Candle Already! - Prime Day Tomorrow",
    "publishedAt": "2025-12-12T22:35:36Z",
    "section": "Daily Close Updates"
  },
  "3z4j2KPHNlw": {
    "summarizedAt": "2025-12-14T03:41:57.753Z",
    "title": "Crypto Daily Update - Another Day Of No Action - Is The Rally Cancelled - Will The Market Break?",
    "publishedAt": "2025-12-13T22:14:58Z",
    "section": "Daily Close Updates"
  },
  "-Fyl-A-rnAc": {
    "summarizedAt": "2025-12-15T03:45:30.795Z",
    "title": "Crypto Daily Update - More Bearish Closes Ahead - Is The Rally Cancelled?",
    "publishedAt": "2025-12-14T23:24:02Z",
    "section": "Daily Close Updates"
  },
  "Qw2TS2bxpyk": {
    "summarizedAt": "2025-12-16T03:38:05.487Z",
    "title": "Crypto Daily Update - Prime Day Dump - Sneaky Exchange Charts - What's The Bigger Picture?",
    "publishedAt": "2025-12-15T23:26:38Z",
    "section": "Daily Close Updates"
  },
  "6Y-kfkWrcqE": {
    "summarizedAt": "2025-12-17T03:24:28.467Z",
    "title": "Crypto Daily Update - The Crypto Market Is Broken - Charts Are Confused - When Will It Break?",
    "publishedAt": "2025-12-16T23:49:45Z",
    "section": "Daily Close Updates"
  },
  "N48CkFVqjcU": {
    "summarizedAt": "2025-12-18T03:25:08.057Z",
    "title": "Crypto Daily Update - Dump Dump Dump! - Is TradingView Showing The Full PIcture?",
    "publishedAt": "2025-12-17T22:16:32Z",
    "section": "Daily Close Updates"
  },
  "S8TZt5Tavyc": {
    "summarizedAt": "2025-12-19T03:28:07.361Z",
    "title": "Crypto Daily Update - Daily Short Into Daily Long - Will They Flip The Support To Resistance?",
    "publishedAt": "2025-12-18T23:30:50Z",
    "section": "Daily Close Updates"
  },
  "O-QblM2XyA4": {
    "summarizedAt": "2025-12-20T03:19:36.326Z",
    "title": "Crypto Daily Update - Prime Day PLUS Important Hidden Closes & Levels on BTC & SOL",
    "publishedAt": "2025-12-19T22:59:10Z",
    "section": "Daily Close Updates"
  },
  "02rHeirbark": {
    "summarizedAt": "2025-12-21T03:42:02.091Z",
    "title": "Crypto Daily Update - Slow Start To The Weekend, When Storm?",
    "publishedAt": "2025-12-20T22:36:20Z",
    "section": "Daily Close Updates"
  },
  "SwEQ9UtCuQA": {
    "summarizedAt": "2025-12-22T03:46:52.906Z",
    "title": "Crypto Daily Update - Will Today Be The Day? MAKE OR BREAK TIME!",
    "publishedAt": "2025-12-22T00:06:22Z",
    "section": "Daily Close Updates"
  },
  "KOy8kiE9njY": {
    "summarizedAt": "2025-12-23T03:39:47.415Z",
    "title": "Crypto Daily Update - BTC Wants Up, SOL Wants Down? - Santa Giving Out Coal!",
    "publishedAt": "2025-12-22T23:05:02Z",
    "section": "Daily Close Updates"
  },
  "ZE09eY7LQaw": {
    "summarizedAt": "2025-12-24T03:28:02.880Z",
    "title": "Crypto Daily Update - SOL Looks Rekt - Big Bearish Closes Or Recovery?",
    "publishedAt": "2025-12-23T22:58:18Z",
    "section": "Daily Close Updates"
  },
  "-eaPyl_gy_w": {
    "summarizedAt": "2025-12-25T03:39:44.956Z",
    "title": "Crypto Daily Update - Merry Xmas - Quick Update - Santa Rally or Coal?",
    "publishedAt": "2025-12-24T23:05:56Z",
    "section": "Daily Close Updates"
  },
  "Hu2OmGE_qb8": {
    "summarizedAt": "2025-12-26T03:37:59.764Z",
    "title": "Crypto Daily Update - More Bearish Closes Ahead For SOL? Why Is BTC Holding Up So Well?",
    "publishedAt": "2025-12-25T23:30:50Z",
    "section": "Daily Close Updates"
  }
}