{
  "sections": [
    {
      "title": "Shorts",
      "items": [
        {
          "title": "Basic TA - $ATOM - General TA advice for Spot Holders",
          "datePT": "2025-10-10",
          "url": "https://youtu.be/M5DyH6pJRzc",
          "videoId": "M5DyH6pJRzc",
          "bullets": [
            "Yeah, you could do that, but you could also just hold on to your own money and wait for this thing to actually change trend and maybe you would never buy it …",
            "So, so okay, you could take a buy there, but you would TP half of your purchase at the trend and then you'd have your stop loss set to break even and you wou…",
            "Um, but you know, realistically, I think everyone could just maybe learn just a little bit of basic TA and that would stop this world of, you know, accumulat…"
          ],
          "permalink": "summaries/2025-10-10-basic-ta-atom-general-ta-advice-for-spot-holders.html"
        },
        {
          "title": "BTC - Nearly Dumped - Saved in the last moments #trading #liquidity #cryptodaily #bitcon",
          "datePT": "2025-09-28",
          "url": "https://youtu.be/rOW3Ih-nIfs",
          "videoId": "rOW3Ih-nIfs",
          "bullets": [
            "I wonder how many people realize we are just sitting on an origin trend for uh BTC and in the last moments of this week they pulled it back up over that trend.",
            "You know, it's it's uh it always seems to be one step away to falling off a cliff."
          ],
          "permalink": "summaries/2025-09-28-btc-nearly-dumped-saved-in-the-last-moments-trading-liquidity-cryptodaily-bitcon.html"
        },
        {
          "title": "SOL to $1000 - Play it safe! #trading #liquidity #cryptodaily #Solana",
          "datePT": "2025-09-12",
          "url": "https://youtu.be/MwxfTHT-BTQ",
          "videoId": "MwxfTHT-BTQ",
          "bullets": [
            "Transcript unavailable — summary skipped."
          ],
          "permalink": "summaries/2025-09-12-sol-to-1000-play-it-safe-trading-liquidity-cryptodaily-solana.html"
        },
        {
          "title": "#BTC - Right in the middle of the 1M channel, do we see $102k or $150k? Which one first?",
          "datePT": "2025-09-10",
          "url": "https://youtu.be/8KlWLSJ5pXo",
          "videoId": "8KlWLSJ5pXo",
          "bullets": [
            "Transcript unavailable — summary skipped."
          ],
          "permalink": "summaries/2025-09-10-btc-right-in-the-middle-of-the-1m-channel-do-we-see-102k-or-150k-which-one-first.html"
        },
        {
          "title": "Education - Scalping Example - New Tokens $WLFI",
          "datePT": "2025-09-01",
          "url": "https://youtu.be/OUdI9xCx3oU",
          "videoId": "OUdI9xCx3oU",
          "bullets": [
            "Transcript unavailable — summary skipped."
          ],
          "permalink": "summaries/2025-09-01-education-scalping-example-new-tokens-wlfi.html"
        },
        {
          "title": "SOL Update | 24/08/2025 - Hopium & Possible Trap - All rolled up in one!",
          "datePT": "2025-08-23",
          "url": "https://youtu.be/6dMxdUOi8IM",
          "videoId": "6dMxdUOi8IM",
          "bullets": [
            "Um, and it is a possibility because sometimes what they'll do is they'll they'll hit a they'll hit a hold level or a resistance level say um at 210 or 211 uh…",
            "If they've done that, they have activated everything right up to the 3-w week um levels, which is which is quite bullish to actually get that stuff out of th…",
            "It's not manipulation, it's just what price does. if um if they pump everyone up over the weekend, induce a tonal longs, leave a couple of resistance levels …"
          ],
          "permalink": "summaries/2025-08-23-sol-update-24-08-2025-hopium-possible-trap-all-rolled-up-in-one.html"
        },
        {
          "title": "SOL Update | 23/08/2025 - Is it time to open a swing trade?",
          "datePT": "2025-08-22",
          "url": "https://youtu.be/7thUJskh6wc",
          "videoId": "7thUJskh6wc",
          "bullets": [
            "Um, and that would be leaving these untested levels down the bottom here, which um is a bit of a ticking time bomb because at some point in the future they g…",
            "Um I'm looking at this now and thinking that if if people are not in a position um by tomorrow once once we see how this plays out it might be a case of look…",
            "So, as this goes sideways, it's it's building this liquidity below and above and so we could get that spike up um even up to like that 119 120 and then uh yo…"
          ],
          "permalink": "summaries/2025-08-22-sol-update-23-08-2025-is-it-time-to-open-a-swing-trade.html"
        },
        {
          "title": "BTC / SOL - 4H Update - Prime Day - Levels & Thoughts so far",
          "datePT": "2025-08-20",
          "url": "https://youtu.be/IbHZ9nAmOV8",
          "videoId": "IbHZ9nAmOV8",
          "bullets": [
            "So we had the bounce off the daily rejection down to the 1618 target which was um uh entering this candle here at 189.526 and then rejecting um back down to …",
            "Um, and I'm sort of looking for the deepest entry down there at about 176. uh if we do continue to go up um the break level on the daily was the next target …",
            "Um, so with BTC sitting all really close to all this 100x liquidity that it it probably will take um whether it tries to fake people out by going up a little…"
          ],
          "permalink": "summaries/2025-08-20-btc-sol-4h-update-prime-day-levels-thoughts-so-far.html"
        },
        {
          "title": "SOL 8D Close - Bullish - Will We Get A Dip to Buy? #trading #liquidity #cryptodaily #solana",
          "datePT": "2025-08-20",
          "url": "https://youtu.be/7v2AXLkkG4A",
          "videoId": "7v2AXLkkG4A",
          "bullets": [
            "Um, it'SA bit of a uh bit of a troll close though because it's definitely set up to pump.",
            "Um it's got probably about an 8 day window looking at looking at the 8day close the the way they positioned it 1 cent back into the all-time high range.",
            "Uh, it's definitely looks to me like AA buy the dip is on the"
          ],
          "permalink": "summaries/2025-08-20-sol-8d-close-bullish-will-we-get-a-dip-to-buy-trading-liquidity-cryptodaily-sola.html"
        },
        {
          "title": "Sound Bite - Shout out to Chris in Fib Lab - Diggling My Frustrations!",
          "datePT": "2025-08-20",
          "url": "https://youtu.be/fJKDE-kC9sE",
          "videoId": "fJKDE-kC9sE",
          "bullets": [
            "Uh, it's in regards to market makers, liquidations, uh, how Hong Kong, London, they build liquidity and then New York um, comes in with the violence to take …",
            "Uh, yeah, it's amazing what AI can put together, but it's um, it's very fitting, very funny.",
            "Liquidation liquidation market makers making no vacation liquidation liquidation. [Music] I'm just diggling diggling my own frustration. [Applause] [Music] J…"
          ],
          "permalink": "summaries/2025-08-20-sound-bite-shout-out-to-chris-in-fib-lab-diggling-my-frustrations.html"
        },
        {
          "title": "BTC - Big players buying the liquidations? - Wen Pump? #trading #liquidity #cryptodaily",
          "datePT": "2025-08-19",
          "url": "https://youtu.be/4PNY1eumgiQ",
          "videoId": "4PNY1eumgiQ",
          "bullets": [
            "Um it can recover from there because it's not hard closed, but um overall impression of the market right now is it looks like short-term pain.",
            "It looks like big players are probably um buying everybody's stops and liquidations and we will and the the higher time frames are still showing reasons to u…",
            "Let's get this reversal time it right and uh let's ride it up."
          ],
          "permalink": "summaries/2025-08-19-btc-big-players-buying-the-liquidations-wen-pump-trading-liquidity-cryptodaily.html"
        },
        {
          "title": "DOGE Coin - Monthly / Weekly / Quick Daily Look",
          "datePT": "2025-08-19",
          "url": "https://youtu.be/Us_GyuDI1gk",
          "videoId": "Us_GyuDI1gk",
          "bullets": [
            "Um, and then with the assumption that because it's broken the range trend, it's going to break through this high, which then means it's broken all of this an…",
            "Um but yeah, you could look at this trend on the daily and if it closes back up inside this area here, which would be back up inside the break levels.",
            "Um maybe just take a little bit of profit off at the um trend or at this level here, which would be the daily um origin breakout level."
          ],
          "permalink": "summaries/2025-08-19-doge-coin-monthly-weekly-quick-daily-look.html"
        },
        {
          "title": "Markets invite you in, then decide what they want to take! #trading #liquidity #cryptodaily",
          "datePT": "2025-08-19",
          "url": "https://youtu.be/WrwDCmtN8_0",
          "videoId": "WrwDCmtN8_0",
          "bullets": [
            "great example of uh how markets build liquidity and move to liquidity.",
            "These people here think it's safe to short.",
            "These people here think it's safe to long."
          ],
          "permalink": "summaries/2025-08-19-markets-invite-you-in-then-decide-what-they-want-to-take-trading-liquidity-crypt.html"
        },
        {
          "title": "110k BTC, Why the delay? #trading #cryptodaily #cryptocurrency #liquidity ##cryptomedia #crypto",
          "datePT": "2025-08-18",
          "url": "https://youtu.be/iQNPhZnTh64",
          "videoId": "iQNPhZnTh64",
          "bullets": [
            "Seems like we just can't come and get this 110 uh spot, can we?",
            "Bitcoin's broken down on the 5day, but it's got this little range trend that it's got to get through if it actually wants to continue the dump down to 112 an…",
            "Uh so so I don't know why they're dragging it out."
          ],
          "permalink": "summaries/2025-08-18-110k-btc-why-the-delay-trading-cryptodaily-cryptocurrency-liquidity-cryptomedia-.html"
        },
        {
          "title": "SOL Close | 18/08/2025 - Quick Speed Update",
          "datePT": "2025-08-18",
          "url": "https://youtu.be/Ba9qqd0-u7M",
          "videoId": "Ba9qqd0-u7M",
          "bullets": [
            "Um assuming it's that main trend, it's up around 236.",
            "Um or it's this trend which is uh sitting about here which uh we reject straight down to that level right now.",
            "Um it's probably the core reason why I think you'll see some form of stage two dump at some point, but um this is looking pretty good."
          ],
          "permalink": "summaries/2025-08-18-sol-close-18-08-2025-quick-speed-update.html"
        },
        {
          "title": "SOL - The Big Dump! - Levels I'm watching",
          "datePT": "2025-08-18",
          "url": "https://youtu.be/-pHdyL1VlUY",
          "videoId": "-pHdyL1VlUY",
          "bullets": [
            "So what happened is just before the weekly close um sort of in the last uhxinutes of it really it just uh price just spiked up here as if it was looking …",
            "But um the fact is there's just a lot of liquidity to the downside and they want to take it and if they're going to push the price up after this um they just…",
            "And and as you can see on SOL, even from a higher time frame perspective, it might it might as well come down into thesexs toxarea at least and grab t…"
          ],
          "permalink": "summaries/2025-08-18-sol-the-big-dump-levels-i-m-watching.html"
        },
        {
          "title": "SOL / BTC Quick Close Update | 17/08/2025",
          "datePT": "2025-08-17",
          "url": "https://youtu.be/UQvui8qlNzs",
          "videoId": "UQvui8qlNzs",
          "bullets": [
            "It's going to want to target um up to 210 um from the trend break, but it's basically sandwiched itself under resistance.",
            "But um but at the same time um keep a close eye on it because uh it could could pump from relatively around here.",
            "And uh yeah, trade safe and um hopefully we get this flush and then uh we spend the next month or so longing uh up to wherever the new top's going to be."
          ],
          "permalink": "summaries/2025-08-17-sol-btc-quick-close-update-17-08-2025.html"
        },
        {
          "title": "SOL - First 2D Scalp From Todays Close - Win",
          "datePT": "2025-08-16",
          "url": "https://youtu.be/gIRTJi71UN0",
          "videoId": "gIRTJi71UN0",
          "bullets": [
            "Um so we're already in accumulation um uh going through the motions on the on the 2-hour.",
            "And so it wasn't going to take that long for that to actually um hit the trend and then break out of the 2-hour range and then come up here to the hold level.",
            "So, um scalped in on the trend and TPD at the hold level and um and that is a trade or um scalp one done for the day."
          ],
          "permalink": "summaries/2025-08-16-sol-first-2d-scalp-from-todays-close-win.html"
        },
        {
          "title": "BTC / SOL - Quick Close Update",
          "datePT": "2025-08-16",
          "url": "https://youtu.be/MbPKHrxKwuk",
          "videoId": "MbPKHrxKwuk",
          "bullets": [
            "It may go down first, accumulate, come back up, but um that's that'SA real positive thing for trying to uh trying to get out of this area.",
            "It hasn't lost that level because it stayed in accumulation, but it's created a downtrend that it's going to have to break on the daily, which is that uh it'…",
            "Nothing moves. could just come down, could go up, but it's on the wrong side of the uptrend, so that's not a great place to be."
          ],
          "permalink": "summaries/2025-08-16-btc-sol-quick-close-update.html"
        },
        {
          "title": "SOL Update - Nice Close - Some targets Hit - Possible Trap for Weekend",
          "datePT": "2025-08-07",
          "url": "https://youtu.be/Rliidceo3rA",
          "videoId": "Rliidceo3rA",
          "bullets": [
            "Um it would be understandable if the monthly move hit that trend uh which is sitting there at about 179 and didn't poke through to the 181 like that would be…",
            "So, just uh don't go too big on positions uh into that weekly support just in case it actually comes through that and hits these um these monthly trends down…",
            "I think there's sort of two possible outcomes and that's that um we're either going to go up because everyone's expecting one final flush and that's what mar…"
          ],
          "permalink": "summaries/2025-08-07-sol-update-nice-close-some-targets-hit-possible-trap-for-weekend.html"
        },
        {
          "title": "SOL / BTC - 4H Update",
          "datePT": "2025-08-03",
          "url": "https://youtu.be/ILD7GgVLpK8",
          "videoId": "ILD7GgVLpK8",
          "bullets": [
            "So uh right on close um the sell pressure of course kicked in and SOL um SOL and BTC down a little bit which uh has kind of parked it under a bit of resistance.",
            "Uh so what that sort of looks like is things like um the balance between SOL and um BTC went into a position where it can break but doesn't mean it has broken.",
            "Um this I mentioned this in a tweet, but I didn't have I don't know if I talked about this in the start uh first video, but we've relocated this um one month…"
          ],
          "permalink": "summaries/2025-08-03-sol-btc-4h-update.html"
        },
        {
          "title": "SOL / BTC / Liquidity Quick Update",
          "datePT": "2025-08-02",
          "url": "https://youtu.be/MSnhhzlNkPU",
          "videoId": "MSnhhzlNkPU",
          "bullets": [
            "Um it is a weekly chart though so it can go up and down up and down up and down but certainly by the end certainly by the end of the week or at least at the …",
            "Um hopefully the liquidity on the bottom side of things doesn't build up too much and um the way it's sort of been lately is most of these pauses over the la…",
            "II still think we're probably going to see more like the low 150s or something lower, but it's um uh if it's not worth them going there, then they'll go take…"
          ],
          "permalink": "summaries/2025-08-02-sol-btc-liquidity-quick-update.html"
        },
        {
          "title": "SOL / ETH Update - Got the Dump Entries - Looking at Targets",
          "datePT": "2025-07-31",
          "url": "https://youtu.be/20Q0MfWZ_-A",
          "videoId": "20Q0MfWZ_-A",
          "bullets": [
            "So uh I've taken some profit just just here and um that's aboutx of the move and um I'll look to take the rest up there.",
            "Uh as far as totals, uh it's probably fair to say that, you know, now that we've broken trend, um we will probably go up and test this resistance one more ti…",
            "So just just yeah if you are opening longs now, if you're feeling really really bullish, just just be careful because um whilst there is probably some upside…"
          ],
          "permalink": "summaries/2025-07-31-sol-eth-update-got-the-dump-entries-looking-at-targets.html"
        },
        {
          "title": "SOL Update - 4H update - Looking ahead to Monthly Close",
          "datePT": "2025-07-30",
          "url": "https://youtu.be/sTMSAC5oyDI",
          "videoId": "sTMSAC5oyDI",
          "bullets": [
            "So so for this trend here is sticky because it's kind of like the same thing as trying to break this range here. um which you know it's tried to do that befo…",
            "And um those two would then have a bit of choppy fight, you know, um pretty big choppy fight like a it's going to be like a $24 choppy fight as it goes up an…",
            "Um but as you can see it's at that trend now and it's it's not really it's not running away, you know, like it's not disappearing off like it did the last ti…"
          ],
          "permalink": "summaries/2025-07-30-sol-update-4h-update-looking-ahead-to-monthly-close.html"
        },
        {
          "title": "SOL Update - Daily Closed back up into range. & 12H Also",
          "datePT": "2025-07-30",
          "url": "https://youtu.be/lMyMxceTq4g",
          "videoId": "lMyMxceTq4g",
          "bullets": [
            "Um so we crept back up inside the daily break level and inside the 12H break level just to retest the trend which um is pretty normal to see right near the e…",
            "Um summary version is that this liquidates people and then they hang around here as long as possible for people to capitulate um close their positions when y…",
            "Um, so really just uh shorts are still open from up here in the 200 area and keep those open, but um uh yeah, adding to longs as as we go down and just start…"
          ],
          "permalink": "summaries/2025-07-30-sol-update-daily-closed-back-up-into-range-12h-also.html"
        },
        {
          "title": "SOL Update - Some support / Target levels for short term moves.",
          "datePT": "2025-07-29",
          "url": "https://youtu.be/9h6LvlosjD4",
          "videoId": "9h6LvlosjD4",
          "bullets": [
            "Um the the reason that that might be a little bit tricky is is just because there will be other resistances um in play um like the backside of the 3-day tren…",
            "So, as far as the longs, um if you'd longed the daily trend, um you down at 179, then the idea would be to um probably even take a little bit of profit now j…",
            "And then certainly 184 um you'd want to take a little bit off the table and then um see how it goes from there. aiming up to 195 or up to 200 just to if it r…"
          ],
          "permalink": "summaries/2025-07-29-sol-update-some-support-target-levels-for-short-term-moves.html"
        },
        {
          "title": "Morning Clarity - 23D Solana Timeframe + Liquidity Target",
          "datePT": "2025-07-29",
          "url": "https://youtu.be/e2pRRbIaeUw",
          "videoId": "e2pRRbIaeUw",
          "bullets": [
            "Uh and then very soon after we've rejected that trend uh which shows signs of deviation or liquidity being grabbed on the lower time frame and uh we've been …",
            "So effectively liquidations to um to gain or sorry to sell as a premium and then coming down here to liquidate to to um buy back at a discount which lines up…",
            "Uh I don't know if it' be some kind of straight line dip because you'd probably take all this and then try to induce people to take some longs by maybe bounc…"
          ],
          "permalink": "summaries/2025-07-29-morning-clarity-23d-solana-timeframe-liquidity-target.html"
        },
        {
          "title": "SOL Update - May have landed a weekly level",
          "datePT": "2025-07-28",
          "url": "https://youtu.be/5mz9-ccGzcw",
          "videoId": "5mz9-ccGzcw",
          "bullets": [
            "So, if this retest holds on that range trend, um, we might actually see uh a base form here. um it may not be the final base and and in fact I doubt it proba…",
            "Um, which works really well with, um, getting rid of those late shorts that have been piling up between here andx. um and would bring me some inner peace …",
            "So, um there's you know nothing's ever random and there's usually a reason and and this might be uh this might be the start of it."
          ],
          "permalink": "summaries/2025-07-28-sol-update-may-have-landed-a-weekly-level.html"
        },
        {
          "title": "BTC & SOL Update 4H since Close",
          "datePT": "2025-07-26",
          "url": "https://youtu.be/yoie9HanzvM",
          "videoId": "yoie9HanzvM",
          "bullets": [
            "Uh we've bounced off that um one day trend and we've hit the 3-day and we're BTC's starting to have a bit of a bit of a pullback off that 3-day.",
            "So, so we're seeing a little bit little bit of strength coming in to SOL, which um it kind of needed because the the levels for SOL to grab its liquidity if …",
            "But um with this change in dominance, it um should be able to get up and uh maybe run into the daily hold or something up a little bit higher before it um be…"
          ],
          "permalink": "summaries/2025-07-26-btc-sol-update-4h-since-close.html"
        }
      ]
    },
    {
      "title": "Daily Close Updates",
      "items": [
        {
          "title": "Crypto Daily Update - Key Levels You MUST Know Just Incase There Is A Trap!",
          "datePT": "2025-11-05",
          "url": "https://youtu.be/FTWw4AOtQTs",
          "videoId": "FTWw4AOtQTs",
          "bullets": [
            "Transcript unavailable — summary skipped."
          ],
          "permalink": "summaries/2025-11-05-crypto-daily-update-key-levels-you-must-know-just-incase-there-is-a-trap.html"
        },
        {
          "title": "Crypto Daily Update | Will The Bounce Ever Come? - Key Levels",
          "datePT": "2025-11-04",
          "url": "https://youtu.be/NSq6Sa-HK8I",
          "videoId": "NSq6Sa-HK8I",
          "bullets": [
            "Transcript unavailable — summary skipped."
          ],
          "permalink": "summaries/2025-11-04-crypto-daily-update-will-the-bounce-ever-come-key-levels.html"
        },
        {
          "title": "Crypto Daily Update - Is the Dump Over?",
          "datePT": "2025-11-03",
          "url": "https://youtu.be/32n76jtR7qc",
          "videoId": "32n76jtR7qc",
          "bullets": [
            "Transcript unavailable — summary skipped."
          ],
          "permalink": "summaries/2025-11-03-crypto-daily-update-is-the-dump-over.html"
        },
        {
          "title": "Crypto Daily Update - Charts are telling us a dump is coming. Will they pump it first?",
          "datePT": "2025-11-02",
          "url": "https://youtu.be/fUyMTgV41so",
          "videoId": "fUyMTgV41so",
          "bullets": [
            "Transcript unavailable — summary skipped."
          ],
          "permalink": "summaries/2025-11-02-crypto-daily-update-charts-are-telling-us-a-dump-is-coming-will-they-pump-it-fir.html"
        },
        {
          "title": "Crypto Daily Update - Will We Break Today? SUNDAY PUMP!!!",
          "datePT": "2025-11-01",
          "url": "https://youtu.be/MCfb0Xl6zWo",
          "videoId": "MCfb0Xl6zWo",
          "bullets": [
            "Transcript unavailable — summary skipped."
          ],
          "permalink": "summaries/2025-11-01-crypto-daily-update-will-we-break-today-sunday-pump.html"
        },
        {
          "title": "Crypto Daily Update - Big BTC Crash, Blow Off Top, Or New Range?",
          "datePT": "2025-10-31",
          "url": "https://youtu.be/xd0JNfuX6cg",
          "videoId": "xd0JNfuX6cg",
          "bullets": [
            "Transcript unavailable — summary skipped."
          ],
          "permalink": "summaries/2025-10-31-crypto-daily-update-big-btc-crash-blow-off-top-or-new-range.html"
        },
        {
          "title": "Crypto Daily Update - Will Big Money Step In To Save The Monthly?",
          "datePT": "2025-10-30",
          "url": "https://youtu.be/XbgwSbJjz7o",
          "videoId": "XbgwSbJjz7o",
          "bullets": [
            "Transcript unavailable — summary skipped."
          ],
          "permalink": "summaries/2025-10-30-crypto-daily-update-will-big-money-step-in-to-save-the-monthly.html"
        },
        {
          "title": "Bitcoin Daily Chart Analysis | Smart Money Levels to Watch Tonight",
          "datePT": "2025-10-29",
          "url": "https://youtu.be/WlWUvOLwI7Q",
          "videoId": "WlWUvOLwI7Q",
          "bullets": [
            "Transcript unavailable — summary skipped."
          ],
          "permalink": "summaries/2025-10-29-bitcoin-daily-chart-analysis-smart-money-levels-to-watch-tonight.html"
        },
        {
          "title": "Crypto Daily Candle Close | Smart Money Setting a Trap Tonight?",
          "datePT": "2025-10-28",
          "url": "https://youtu.be/IqyIAW79QoM",
          "videoId": "IqyIAW79QoM",
          "bullets": [
            "Transcript unavailable — summary skipped."
          ],
          "permalink": "summaries/2025-10-28-crypto-daily-candle-close-smart-money-setting-a-trap-tonight.html"
        },
        {
          "title": "Crypto Daily Update - Low timeframe trying to recover, high timeframe setting a trap.",
          "datePT": "2025-10-27",
          "url": "https://youtu.be/e4Lbz_3Vk9Y",
          "videoId": "e4Lbz_3Vk9Y",
          "bullets": [
            "Um just a little a little thing would be that we don't so say say for example we do not close over 208 for um the month but then next month we close over abo…",
            "So it's um you at the moment if we come down here and we look bearish for a long time and then you get a wick up there then don't be surprised and same thing…",
            "It's almost instantaneously when we closed the candle yesterday we started to rally and that allowed them to go up there and make people feel really bullish …"
          ],
          "permalink": "summaries/2025-10-27-crypto-daily-update-low-timeframe-trying-to-recover-high-timeframe-setting-a-tra.html"
        },
        {
          "title": "Crypto Daily Close | 26/10/2025 - Key Levels - Will they reverse the weekend pump?",
          "datePT": "2025-10-26",
          "url": "https://youtu.be/ssSOtSRR6CQ",
          "videoId": "ssSOtSRR6CQ",
          "bullets": [
            "To be bullish, you almost want it to go down first just because you want them to leave this big block of um BTC liquidity behind. uh if they just go powering…",
            "And um, SOL actually SOL's been very bullish. been saying it for a few days now that it's just looked a lot stronger, but it's just kind of come up and it's …",
            "And that's how you get nice moves that just give continuation is basically candles with small wicks on the top and then open over the top and bounce the next…"
          ],
          "permalink": "summaries/2025-10-26-crypto-daily-close-26-10-2025-key-levels-will-they-reverse-the-weekend-pump.html"
        },
        {
          "title": "Crypto Daily Update | Looking Ahead To Major Weekly Closes",
          "datePT": "2025-10-25",
          "url": "https://youtu.be/CrjKXAGSlt8",
          "videoId": "CrjKXAGSlt8",
          "bullets": [
            "So, um, I think it's probably just completing some of that. the once it has done that though, the the the thing that's probably a little bit more of a worry …",
            "And, um, you could have AA bias if you wanted to and say, I believe it's going to go up, and therefore, you know, I like this compression because I believe i…",
            "So um this is this sort of um rejection here in this in the strength of safety assets is sort of why you're seeing things like sooie pop hype pop as popped y…"
          ],
          "permalink": "summaries/2025-10-25-crypto-daily-update-looking-ahead-to-major-weekly-closes.html"
        },
        {
          "title": "Crypto Daily Update | 24/10/2025 - Can we keep reclaiming levels or will the HTF trap kick in?",
          "datePT": "2025-10-24",
          "url": "https://youtu.be/pZ7XV8UYn8E",
          "videoId": "pZ7XV8UYn8E",
          "bullets": [
            "We've had the 4day, 5day, all just creep back up above their um uh supports and then they've bounced off those supports and then that's why the price has kin…",
            "Uh so, if it does strike there, then that's sometimes a good area that um to take profits on any trades related to SOL. uh if it does end up breaking the bre…",
            "So, um, if that was a hard close and we get over the top of this one, it's probably just natural that it's going to come back up here and try to test that 1.…"
          ],
          "permalink": "summaries/2025-10-24-crypto-daily-update-24-10-2025-can-we-keep-reclaiming-levels-or-will-the-htf-tra.html"
        },
        {
          "title": "Crypto Daily Update | Bullish Flip - Is it just another trap? or Will they close over key levels?",
          "datePT": "2025-10-23",
          "url": "https://youtu.be/zTe2NIHPvas",
          "videoId": "zTe2NIHPvas",
          "bullets": [
            "Um and of course if they wanted to take a dive again, then you everything's still open. the the actual range of price that we're in right now is just so wide…",
            "There's plenty to take to the downside if we look at the 7-day, but there's still something that could take to the upside. probably be a little bit wary if i…",
            "Yeah, BTC on the 30-day really it's just do they go and take everything down to that 103 or do they go all the way up to 119."
          ],
          "permalink": "summaries/2025-10-23-crypto-daily-update-bullish-flip-is-it-just-another-trap-or-will-they-close-over.html"
        },
        {
          "title": "Crypto Daily Update | 22/10/2025 - Are they brewing the next big dump? Or bounce before close?",
          "datePT": "2025-10-22",
          "url": "https://youtu.be/12rLTZBcf70",
          "videoId": "12rLTZBcf70",
          "bullets": [
            "Um, and it's it's got a bit of liquidity sort of building up um, just in this sort of 107 through to that kind of 109 area.",
            "So So although it's got all of this leverage to to go and dive into to the downside, it's it's actually getting a reason to go up because people are actually…",
            "But um yeah, you can't really expect the entire altcoin market to be uh going strong if this thing starts to move up. a retrace back to the level might be a …"
          ],
          "permalink": "summaries/2025-10-22-crypto-daily-update-22-10-2025-are-they-brewing-the-next-big-dump-or-bounce-befo.html"
        },
        {
          "title": "Crypto Daily Update | 21/10/2025 - Confused Yet? Price seems to be!",
          "datePT": "2025-10-21",
          "url": "https://youtu.be/Gbyg4Yag10I",
          "videoId": "Gbyg4Yag10I",
          "bullets": [
            "Um, and even if we are, you know, in a final stage of a bull run and and say we're going to go to a blowoff top, it's not uncommon for there just to be these…",
            "And given it's um capable of a very big rejection, if they've got this huge gap and they want to dump really quickly to make sure that these longs get trappe…",
            "And you know, SOL has got moves to the upside which go all the way up to 286 just based on um you know, fib levels and uh we've got you know, trends that nee…"
          ],
          "permalink": "summaries/2025-10-21-crypto-daily-update-21-10-2025-confused-yet-price-seems-to-be.html"
        },
        {
          "title": "Crypto Daily Update | 19/10/2025 - Are Key Levels Getting Recovered?",
          "datePT": "2025-10-19",
          "url": "https://youtu.be/EP2WZAAlQHM",
          "videoId": "EP2WZAAlQHM",
          "bullets": [
            "Uh the daily target for uh the thexum daily target for uh SOL based on bouncing off the um front side hold level that's already been hit as well.",
            "Um but at the same time, we go back to that one day and one day says suddenly people have gone, \"Oh, actually, maybe we're not.\" And they're starting to long…",
            "So looking at SOL BTC on the daily um the first the first thing that you know stands out to me still and you said this yesterday as well is that we haven't a…"
          ],
          "permalink": "summaries/2025-10-19-crypto-daily-update-19-10-2025-are-key-levels-getting-recovered.html"
        },
        {
          "title": "Crypto Daily Update | 18/10/2025 - Key Levels for Today & Weekly Close",
          "datePT": "2025-10-18",
          "url": "https://youtu.be/CjgCwsycEdA",
          "videoId": "CjgCwsycEdA",
          "bullets": [
            "As far as the 30-day, yeah, 30 days definitely got more to the upside. um a lot of a lot of these really big moves have kicked in on SOL and even just lookin…",
            "It's not a hard close of the you not a hard close of anything until what whatever whatever comes tomorrow but um still there'SA little bit of hope there that…",
            "Um, if we have that and we're kind of back up on top of that interior trend and we have a hold level, then we can actually then just bounce off that and head…"
          ],
          "permalink": "summaries/2025-10-18-crypto-daily-update-18-10-2025-key-levels-for-today-weekly-close.html"
        },
        {
          "title": "Crypto Daily Update | 17/10/2025 - Is this fake? Big dump coming? SOL & BTC telling different Story",
          "datePT": "2025-10-17",
          "url": "https://youtu.be/m_RgvFtoNsw",
          "videoId": "m_RgvFtoNsw",
          "bullets": [
            "Um, but just looking at these charts, I figured I would do one anyway because they are pretty pivotal today. um there could be some closes and it is really t…",
            "SOL's found some high time frame support and could definitely bounce uh from here, but of course it's not going to do that if BTC absolutely tanks and uh yea…",
            "Um but if it was to pull back under the level, create a big trend or a big wick, um and then come up, reject off the lot and go down, then you'll see a recov…"
          ],
          "permalink": "summaries/2025-10-17-crypto-daily-update-17-10-2025-is-this-fake-big-dump-coming-sol-btc-telling-diff.html"
        },
        {
          "title": "Crypto Daily Update | 16/10/2025 - Looking Bearish",
          "datePT": "2025-10-16",
          "url": "https://youtu.be/E_MBCJqwKWQ",
          "videoId": "E_MBCJqwKWQ",
          "bullets": [
            "So even though these these um uh heat maps or liquidation maps definitely look like the price should be skyrocketing and going to the upside, um the structur…",
            "They um there was AA dip down and then there was like this if you look on the low time frame there was um a sudden spike up uh last night which was um when w…",
            "Um and BTC uh you know if they were to go down and target that sort ofxxarea again it's still a higher high than um sorry a higher low than where it w…"
          ],
          "permalink": "summaries/2025-10-16-crypto-daily-update-16-10-2025-looking-bearish.html"
        },
        {
          "title": "Crypto Daily Update | 15/10/2025 - Even I'm Confused",
          "datePT": "2025-10-15",
          "url": "https://youtu.be/FhTgDuogAIM",
          "videoId": "FhTgDuogAIM",
          "bullets": [
            "So don't know if I like that confluence, but um hey, if it happens, it could end up being one of the best shorts um that you're going to see.",
            "Like it it could just pull up pull up just a little bit and then be in a position of strength, pull down just a little bit, be in a position of, you know, um…",
            "And yeah, if this goes back to 68% that's another one of those big nasty alt dumps that you're going to see like like when you had that um spike up there. it…"
          ],
          "permalink": "summaries/2025-10-15-crypto-daily-update-15-10-2025-even-i-m-confused.html"
        },
        {
          "title": "Crypto Daily Update | 14/10/2025 - Can you trust this bounce yet?",
          "datePT": "2025-10-14",
          "url": "https://youtu.be/cUuc0o0h65o",
          "videoId": "cUuc0o0h65o",
          "bullets": [
            "Um if we go to the 7-day, you know, same thing pretty much on SOL even playing field up or down. uh BTC a little bit more of a bias to to take um shorts, but…",
            "You might it might come back down to that 107 area, maybe that 108 area um as a bit of a dip to take all that stuff to the bottom. uh and uh if suddenly Chin…",
            "Um but so many people have chased this pump that there is all this lower time frame stuff and you know for BTC to get back to that higher time frame liquidit…"
          ],
          "permalink": "summaries/2025-10-14-crypto-daily-update-14-10-2025-can-you-trust-this-bounce-yet.html"
        },
        {
          "title": "Crypto Daily Update | 13/10/2025 - Showing how fast they can flip structure!",
          "datePT": "2025-10-13",
          "url": "https://youtu.be/kanw_VF-5zs",
          "videoId": "kanw_VF-5zs",
          "bullets": [
            "Um and certainly it's basically evened out like you you'd think after masses of liquidations people would be very very bullish and um of the price basically …",
            "And I probably harp on about this a lot, but you know there's if you look at things like X, there's you know thousands of influencers who are trying to give …",
            "So, you know, I suppose you can look at two different directions, but looking at the the 30-day leverage, uh that 107 area, 108 area still definitely on the …"
          ],
          "permalink": "summaries/2025-10-13-crypto-daily-update-13-10-2025-showing-how-fast-they-can-flip-structure.html"
        },
        {
          "title": "Crypto Daily Update | 12/10/2025 - Massive closes today. Key levels. Market looks primed.",
          "datePT": "2025-10-12",
          "url": "https://youtu.be/FRquQZMcCZM",
          "videoId": "FRquQZMcCZM",
          "bullets": [
            "Um, personally I feel a little bit uh embarrassed by the fact that I wasn't watching things like four-week charts um on a daily basis and and if you had been…",
            "So that's um that's what we looking at on the one day. on the 7-day uh you could see that you know pushing pushing SOL up but pushing SOL down would actually…",
            "Now it's in it's in different hands because some people lost and some people um some people you know gained out of it but the but some of that money that was…"
          ],
          "permalink": "summaries/2025-10-12-crypto-daily-update-12-10-2025-massive-closes-today-key-levels-market-looks-prim.html"
        },
        {
          "title": "Crypto Daily Update | 11/10/2025 - Could we really pump from here? - $TSLA / $ADA By Request",
          "datePT": "2025-10-11",
          "url": "https://youtu.be/YRnpJZzvpm0",
          "videoId": "YRnpJZzvpm0",
          "bullets": [
            "Um there's also a bit of a tin hat thing which um you know I've talked about in the discord with a couple of guys who like to count um count candles or whate…",
            "And um there's been some really interesting chat, you know, popping up on X and, you know, the the mainstream people with, you know, 100,000 followers are ju…",
            "And it was a means of wealth transfer from all of these people sitting on zombie coins um you know into the the big players who just really wanted to short t…"
          ],
          "permalink": "summaries/2025-10-11-crypto-daily-update-11-10-2025-could-we-really-pump-from-here-tsla-ada-by-reques.html"
        },
        {
          "title": "Crypto Daily Update - | 10/10/2025 - Prime Day Chaos",
          "datePT": "2025-10-10",
          "url": "https://youtu.be/kYAAsQey6rQ",
          "videoId": "kYAAsQey6rQ",
          "bullets": [
            "Um there was this, you know, months and months and months ago, we were talking about this level down at about 144 where they hadn't quite hit the hold level.…",
            "Uh I mean even even the high time frame liquidity is just completely wiped out. the bounce back from it has been very very bullish which um uh if it is to ho…",
            "But really the you don't know whether this kind of thing is going to become a monthly downtrend until you see the close um because it could create a hold lev…"
          ],
          "permalink": "summaries/2025-10-10-crypto-daily-update-10-10-2025-prime-day-chaos.html"
        },
        {
          "title": "Crypto Daily Update | 09/10/2025 - Should you be bearish or bullish?",
          "datePT": "2025-10-09",
          "url": "https://youtu.be/-cQPPnEcsQo",
          "videoId": "-cQPPnEcsQo",
          "bullets": [
            "Um so looking at the uh daily liquidity um it's it sort of would imply that SOL should make a bit of a move up and we do um uh we do have a couple of moves j…",
            "So, you know, it's um if you look at it from both directions, uh all these charts are really saying is that it would be unusual for them not to take this liq…",
            "So, um you know, SOL it I don't know if they do take that 212 area, I don't know if that's where they will, you know, uh spin around and bounce to a higher l…"
          ],
          "permalink": "summaries/2025-10-09-crypto-daily-update-09-10-2025-should-you-be-bearish-or-bullish.html"
        },
        {
          "title": "Crypto Daily Update | 8/10/2025 - Minor flush yesterday, was that all?",
          "datePT": "2025-10-08",
          "url": "https://youtu.be/xDPJelJ9VgQ",
          "videoId": "xDPJelJ9VgQ",
          "bullets": [
            "Um and yesterday was a prime exchange day which um so it's also been doing a lot of research around trying to figure out what these uh universal anchor dates…",
            "So, yeah, it's just uh maybe this becomes the hated part of the rally where they leave all this stuff behind and just go up. and they might be leaving the um…",
            "Um, now unfortunately, this level that's up here, well, it's the same thing but in reverse, it got swept, it came back down, and this candle that we're in ri…"
          ],
          "permalink": "summaries/2025-10-08-crypto-daily-update-8-10-2025-minor-flush-yesterday-was-that-all.html"
        },
        {
          "title": "Crypto Daily Update | 7/10/2025 - We need a last minute pump... or more dump coming!",
          "datePT": "2025-10-07",
          "url": "https://youtu.be/p6cMNCphyv8",
          "videoId": "p6cMNCphyv8",
          "bullets": [
            "As far as BTC, it's kind of interesting because it's it's had a lot of hard closes and it's got a lot of high time frame support, but um uh so it does beg th…",
            "Um but whether it would hold and actually give you much more of a push up into the top um resistance is a whole another question because it's relatively low …",
            "Um but really what we need this thing to do is we need it to close a day uh completely separated from that 64.91 line. um we really need it to be uh somewher…"
          ],
          "permalink": "summaries/2025-10-07-crypto-daily-update-7-10-2025-we-need-a-last-minute-pump-or-more-dump-coming.html"
        },
        {
          "title": "Crypto Daily Update | 6/10/2025 - Rotation Please....",
          "datePT": "2025-10-06",
          "url": "https://youtu.be/AUoC5U4HRmI",
          "videoId": "AUoC5U4HRmI",
          "bullets": [
            "Um, so you know, we've we've definitely got uh a bit of room to play, but because of the SOL BTC chart, you know, SOL's just been basically lagging behind BT…",
            "So, having this gap that's at the top here and uh the day of the week and the fact we've just come through this really bullish weekend, um it might be the da…",
            "If we get this hold level today and then we can bounce off that hold level and hopefully break through this resistance, then you can see strength come back i…"
          ],
          "permalink": "summaries/2025-10-06-crypto-daily-update-6-10-2025-rotation-please.html"
        },
        {
          "title": "Crypto Daily Update | 05/10/2025 - Is it time for BTC rotation or one more dip to come?",
          "datePT": "2025-10-05",
          "url": "https://youtu.be/uDbloU7OYJs",
          "videoId": "uDbloU7OYJs",
          "bullets": [
            "Uh you know 240 is unchanged on the 7-day um when it comes to SOL and down to 203.6 which is an interesting number cuz 204 is the 3month backside um candle a…",
            "So, this is pretty much now showing that the real hallmarks of the final stage of the bull market where, you know, your altcoins are going to really have the…",
            "Um, we've got some levels in that 243 area, which might stop us getting there, but, you know, and and if we head to the downside, um, pretty much you can see…"
          ],
          "permalink": "summaries/2025-10-05-crypto-daily-update-05-10-2025-is-it-time-for-btc-rotation-or-one-more-dip-to-co.html"
        },
        {
          "title": "Crypto Daily Update | 04/10/2025 - Weekend Trap for Alts?",
          "datePT": "2025-10-04",
          "url": "https://youtu.be/blesWnFypuk",
          "videoId": "blesWnFypuk",
          "bullets": [
            "But uh uh outside of that, uh we are on a weekend and um you can tell looking at the um uh one day liquidity charts on Bitcoin there, it's become its lovely …",
            "It's going to be able to push up and push down um or down and up, but it's going to live in this little area here until it can actually break out of that eit…",
            "Um, it's still in the bigger picture trying to work its way up to test uh these hold levels up uh up towards this 200 or 20308 area um or 2015 area, but it's…"
          ],
          "permalink": "summaries/2025-10-04-crypto-daily-update-04-10-2025-weekend-trap-for-alts.html"
        },
        {
          "title": "Crypto Daily Update | 3/10/2025 - Should you be waiting for a pullback?",
          "datePT": "2025-10-03",
          "url": "https://youtu.be/AIDc-YQEoSU",
          "videoId": "AIDc-YQEoSU",
          "bullets": [
            "Uh looking at SOL, um SOL still hasn't hit its one day target yet, but uh something I noticed today is that the one day candle is actually um encapsulated in…",
            "And um that's the one case for maybe just sending uh SOL up on a big tear is that why let these people out, you know, if you've got them underwater uh and th…",
            "Uh and over on SOL, you know, that was thatxwas thatx-day um uh violence where it just hit that uh hit that hold level on the exchange and then, you kno…"
          ],
          "permalink": "summaries/2025-10-03-crypto-daily-update-3-10-2025-should-you-be-waiting-for-a-pullback.html"
        },
        {
          "title": "Crypto Daily Update | 2/10/2025 - Pump, Pump & More Pump",
          "datePT": "2025-10-02",
          "url": "https://youtu.be/-xwRWHTApVQ",
          "videoId": "-xwRWHTApVQ",
          "bullets": [
            "Uh but if it does go for a dive um it'll be back down to that sort of 200 area that you maybe as low as the 180s 190s but it's um at this stage it's looking …",
            "If we do have a dip and that dip doesn't get you out, you you're going to want to you're going to want to be looking for a plan B because, you know, there's …",
            "Uh but it's yeah at this stage looking very bullish. um if they want to mess with everybody, what they're going to do is they're just going to start probably…"
          ],
          "permalink": "summaries/2025-10-02-crypto-daily-update-2-10-2025-pump-pump-more-pump.html"
        },
        {
          "title": "Crypto Daily Update | 01/10/2025 - The Squeeze - Now What?",
          "datePT": "2025-10-01",
          "url": "https://youtu.be/99j3aHztqAA",
          "videoId": "99j3aHztqAA",
          "bullets": [
            "And if we do that, we probably it it really just comes down to whether we close over the top of them um and then head off into, you know, price discovery or …",
            "So we ran into the backside resistance at several points as the price is going up and that's you know that's kind of like your 217s and 219s and then 220 but…",
            "Um but yeah, just keep in mind you when you start to see um front side resistance coming in, it usually means that the range is rolling over. um one minute f…"
          ],
          "permalink": "summaries/2025-10-01-crypto-daily-update-01-10-2025-the-squeeze-now-what.html"
        },
        {
          "title": "Crypto Daily Update | 30/09/2025 - Why are they pulling back JUST before close? (AKA Scammy Pump?)",
          "datePT": "2025-09-30",
          "url": "https://youtu.be/muwx8kGfb5M",
          "videoId": "muwx8kGfb5M",
          "bullets": [
            "So unfortunately the levels that we're sitting at, I don't think are going to be the final bottom levels. um just solely because they're just letting the liq…",
            "Um maybe they push up toxor you knowxI think later is the area we're going to see on the charts that makes a bit of sense andxxaybexum to …",
            "So, it's still got the targets to the upside that it's going to want to hit like um uh we got targets here atxwhich would be very bullish and that wou…"
          ],
          "permalink": "summaries/2025-09-30-crypto-daily-update-30-09-2025-why-are-they-pulling-back-just-before-close-aka-s.html"
        },
        {
          "title": "Crypto Daily Update | 29/09/2025 - We got our pump.. Now what?",
          "datePT": "2025-09-29",
          "url": "https://youtu.be/Hym2JF7S0m8",
          "videoId": "Hym2JF7S0m8",
          "bullets": [
            "Um but um so when we look at these charts uh soon it is also looking like we're basically just seeing one really big deviation of trend and it it was quite c…",
            "You know, we might just go back up there and have another rejection um around that 226. the uh and the bottom end of of the liquidity is you know all the way…",
            "So is 104 for that matter, you know, but really if they went down and hit 107, they've taken just about everything uh on BTC that's in that 30-day realm and …"
          ],
          "permalink": "summaries/2025-09-29-crypto-daily-update-29-09-2025-we-got-our-pump-now-what.html"
        },
        {
          "title": "Crypto Daily Update | 28/09/2025 - The Sunday PUMP!",
          "datePT": "2025-09-28",
          "url": "https://youtu.be/wWUl-D2Uajs",
          "videoId": "wWUl-D2Uajs",
          "bullets": [
            "It's it's really the newer positions are going to get liquidated even if they just get up to about umxwhich uh you might have Oh, alerts going off.",
            "So, there's there's newer longs coming in, there's newer shorts coming in, which um just gives them plenty of ability to move in either direction quite quick…",
            "So we might find that this becomes you know a reversal for the strength of alts and that could be next week um because it might get triggered and then it mig…"
          ],
          "permalink": "summaries/2025-09-28-crypto-daily-update-28-09-2025-the-sunday-pump.html"
        },
        {
          "title": "Crypto Daily Update | 27/09/2025 - End of Week/Month Pump? Or More Dump?",
          "datePT": "2025-09-27",
          "url": "https://youtu.be/v396t_nUY88",
          "videoId": "v396t_nUY88",
          "bullets": [
            "Whereas you can see something might be coming for SOL where it's just you know there'SA lot of liquidity up into that 220 and uh there'SA few things that sor…",
            "So, you know, every big move we've had on BTC uh lately, well, lately I should say this cycle, uh everyone's expected it to go to some really low low and the…",
            "So um so if we look at the 30-day 30-day liquidity same thing pretty much down to about you know 104 on BTC uh and you know there's clear groups and one of t…"
          ],
          "permalink": "summaries/2025-09-27-crypto-daily-update-27-09-2025-end-of-week-month-pump-or-more-dump.html"
        },
        {
          "title": "Crypto Daily Update | 26/09/2025 - Looking good!",
          "datePT": "2025-09-26",
          "url": "https://youtu.be/TQGbvSQJZl4",
          "videoId": "TQGbvSQJZl4",
          "bullets": [
            "So the same key numbers like down to 105 on um BTC and down to sort of like the 180s uh are visible on SOL and uh we've we've had a few people come in with s…",
            "The real question is will they take this area down to um you know 105 and you know will you see another dip down here to the sort of 180 area on um on SOL be…",
            "It's bounced the support trend. there is a really steep range trend that's coming down from the previous um upper range and it's in a perfect position really…"
          ],
          "permalink": "summaries/2025-09-26-crypto-daily-update-26-09-2025-looking-good.html"
        },
        {
          "title": "Crypto Daily Update | 25/09/2025 - Ouch - There is blood in the markets and maybe more today.",
          "datePT": "2025-09-25",
          "url": "https://youtu.be/HKq8Gb-iSIM",
          "videoId": "HKq8Gb-iSIM",
          "bullets": [
            "Um and on BTC probably up to about um 1,900 uh or you know 119 120 maybe but and I suppose liquidity would build as people try to protect their shorts and th…",
            "So, uh, there'SA slight issue with this, and that's that if it actually opens on the underside of that, which is, um, 1793, it can just reject straight off t…",
            "Um so you really want to see it just come up a little bit before the end of the day and then it could um at least travel down like even if they're going to g…"
          ],
          "permalink": "summaries/2025-09-25-crypto-daily-update-25-09-2025-ouch-there-is-blood-in-the-markets-and-maybe-more.html"
        },
        {
          "title": "Crypto Daily Update | 24/09/2025 - This IS a correction, but is it over?",
          "datePT": "2025-09-24",
          "url": "https://youtu.be/7ZIwu5sH7AQ",
          "videoId": "7ZIwu5sH7AQ",
          "bullets": [
            "Now it's um yeah whether they even bother to go up and take you know when when you look at this balance do they even bother going up to take 114 before they …",
            "Um we've sort of been held under a dominance uh down sorry, we've been held under a market cap downtrend. um which really is just means that everything's in …",
            "Um but you know that rejection could you know reverse and then it can travel up and down because effectively it's it'SA weekly or a daily level rejection so …"
          ],
          "permalink": "summaries/2025-09-24-crypto-daily-update-24-09-2025-this-is-a-correction-but-is-it-over.html"
        },
        {
          "title": "Crypto Daily Update | 23/09/2025 - Some signs of reversal appearing - One more sweep?",
          "datePT": "2025-09-23",
          "url": "https://youtu.be/ULghsrVNaLM",
          "videoId": "ULghsrVNaLM",
          "bullets": [
            "Um, we don't seem to have that a reason just to go there in a straight line. however, which might be why it's it sort of just coming down, stays down, builds…",
            "There'SA lot of these positions that would have been in profit, but now they are um trapped or they're borderline, you know, and if we get another push down …",
            "Like to really get all of this fixed, we need SOL to stay flat and BDC to spike or we need um BDC to absolutely pump and SOL to pump slightly. or if we reall…"
          ],
          "permalink": "summaries/2025-09-23-crypto-daily-update-23-09-2025-some-signs-of-reversal-appearing-one-more-sweep.html"
        },
        {
          "title": "Crypto Daily Update | 22/09/2025 - Same Again? Mixed signals on SOL - BTC Weak - Need a good close!",
          "datePT": "2025-09-22",
          "url": "https://youtu.be/OfPSQDG0v_A",
          "videoId": "OfPSQDG0v_A",
          "bullets": [
            "Um the levels you know that we we see here uh same really you know 111 um sorry uh 211 on um SOL and if we were to drop down it's still sort of that you know…",
            "So I mean the charts looked really bad and they have looked really bad for several days now. um was not quite expecting the nose dive to be so big and so fas…",
            "It's still in that monthly, you know, monthly rejection um which, you know, isn't really going to get resolved unless it actually gets down to sort of that 0…"
          ],
          "permalink": "summaries/2025-09-22-crypto-daily-update-22-09-2025-same-again-mixed-signals-on-sol-btc-weak-need-a-g.html"
        },
        {
          "title": "Crypto - Dump Update - By Request - We Knew This Was Coming Guys!",
          "datePT": "2025-09-22",
          "url": "https://youtu.be/3kzWMUJfp10",
          "videoId": "3kzWMUJfp10",
          "bullets": [
            "Uh you could definitely, you know, argue that it's going to end up going up above this at some point.",
            "So yeah, she's um she's looking pretty bearish and I don't know whether this pullback is uh going to be over.",
            "And uh if it doesn't, if it closes down here, you on the day, then it's probably going to come back up here. there'SA very high likelihood then it rejects of…"
          ],
          "permalink": "summaries/2025-09-22-crypto-dump-update-by-request-we-knew-this-was-coming-guys.html"
        },
        {
          "title": "Crypto Daily Update | 21/09/2025 - Charts Look like they want to dump, but if so, how far?",
          "datePT": "2025-09-21",
          "url": "https://youtu.be/LuXTRj9kuXM",
          "videoId": "LuXTRj9kuXM",
          "bullets": [
            "So uh yeah, people have been opening positions um high risk, high leverage uh really close to current price, which uh it's kind of exactly what um big player…",
            "Um, the only thing I starting to see though, and we'll see this when we start to look at the charts, is they might build additional hold levels at lower pric…",
            "Um, and pretty much what we're seeing here now is we're seeing uh all the way from the very top here, we're seeing it didn't quite hit the break level, stopp…"
          ],
          "permalink": "summaries/2025-09-21-crypto-daily-update-21-09-2025-charts-look-like-they-want-to-dump-but-if-so-how-.html"
        },
        {
          "title": "Crypto Daily Update | 20/09/2025 - Need a pump to save us!",
          "datePT": "2025-09-20",
          "url": "https://youtu.be/Gzya-LvQFdw",
          "videoId": "Gzya-LvQFdw",
          "bullets": [
            "Uh it's looking particularly weak structurally and although today'SA prime day and there's only a one day close today, there are a ton of closes coming tomor…",
            "So, um, so as it currently stands, I'm sort of eyeing still eyeing up that, um, 112800 area to the downside and and, uh, still looking to TP if we start trav…",
            "Uh but yeah, it's looking like it's got um both sides um ready to go and areas like 2223 uh right up to sort of that 250 cluster 258 um starting to come in."
          ],
          "permalink": "summaries/2025-09-20-crypto-daily-update-20-09-2025-need-a-pump-to-save-us.html"
        },
        {
          "title": "Crypto Daily Update | 19/09/2025 - Pullback signs are there, but how low will it go?",
          "datePT": "2025-09-19",
          "url": "https://youtu.be/QMLS-Cf8sQw",
          "videoId": "QMLS-Cf8sQw",
          "bullets": [
            "Um, and it may be, you know, they don't always come down and take all this, but certainly if they wanted to go and, you know, tap that um 214, 213 uh area, u…",
            "Um and you know the sentiment on um X's flipped pretty quickly as everyone was talking you know retire on everything and let's go to a,000 and all this kind …",
            "Um so we've been sideways just in the shorter term since we sort of came down to around this um 115k area and we have got some like low time frame supports i…"
          ],
          "permalink": "summaries/2025-09-19-crypto-daily-update-19-09-2025-pullback-signs-are-there-but-how-low-will-it-go.html"
        },
        {
          "title": "Crypto Daily Update | 18/09/2025 - Last 1D+ Hold Resistance on SOL.. What's next?",
          "datePT": "2025-09-18",
          "url": "https://youtu.be/Rw9PtweTzY8",
          "videoId": "Rw9PtweTzY8",
          "bullets": [
            "Um so one day liquidity on on SOL uh definitely looks like it should take some kind of pullback you know to that 130s area sorry 130s getting ahead of myself…",
            "So, um yeah, I'd be I'd be a little bit uh well, if we do get some Bank of Japan shock today, a 1% increase or something, maybe um maybe it goes for a bit of…",
            "So, um, so what you saw yesterday, like if if you have a look at yesterday's video and, um, just have a look at some of the charts and what they were like, y…"
          ],
          "permalink": "summaries/2025-09-18-crypto-daily-update-18-09-2025-last-1d-hold-resistance-on-sol-what-s-next.html"
        },
        {
          "title": "Crypto Daily Update | 17/09/2025 - FOMC - News - Noise - What Now?",
          "datePT": "2025-09-17",
          "url": "https://youtu.be/HSoSkYBnApo",
          "videoId": "HSoSkYBnApo",
          "bullets": [
            "You 117 we we hit that on um we actually hit that 1172 number that structural um hold level on BTC that we talked about uh yesterday and that's rejected off …",
            "Um so, you know, I we are going to get a hold level and that could um that could either mean that price comes back a bit first or strength comes back a bit f…",
            "Um, so really, we're just watching to see whether it closes below the trend. uh which you know is anywhere up to about 20592 and um and if it's got a wick on…"
          ],
          "permalink": "summaries/2025-09-17-crypto-daily-update-17-09-2025-fomc-news-noise-what-now.html"
        },
        {
          "title": "Crypto Daily Update | 16/09/2025 - News Inbound, HTF levels Hovering.",
          "datePT": "2025-09-16",
          "url": "https://youtu.be/C7I7F6iNQvI",
          "videoId": "C7I7F6iNQvI",
          "bullets": [
            "Transcript unavailable — summary skipped."
          ],
          "permalink": "summaries/2025-09-16-crypto-daily-update-16-09-2025-news-inbound-htf-levels-hovering.html"
        },
        {
          "title": "Crypto Daily Update | 15/09/2025 - Will you catch the next pump?",
          "datePT": "2025-09-15",
          "url": "https://youtu.be/lyb3Ee5kauU",
          "videoId": "lyb3Ee5kauU",
          "bullets": [
            "Transcript unavailable — summary skipped."
          ],
          "permalink": "summaries/2025-09-15-crypto-daily-update-15-09-2025-will-you-catch-the-next-pump.html"
        },
        {
          "title": "Crypto Daily Update | 14/09/2025 - Will big players derisk?",
          "datePT": "2025-09-14",
          "url": "https://youtu.be/f2RalTqlPJ8",
          "videoId": "f2RalTqlPJ8",
          "bullets": [
            "Transcript unavailable — summary skipped."
          ],
          "permalink": "summaries/2025-09-14-crypto-daily-update-14-09-2025-will-big-players-derisk.html"
        },
        {
          "title": "Crypto Daily Update | 12/09/2025 - b00m - SOL taking off! The July 102D - $247 target explained",
          "datePT": "2025-09-12",
          "url": "https://youtu.be/Hlc8yLoqtbM",
          "videoId": "Hlc8yLoqtbM",
          "bullets": [
            "Transcript unavailable — summary skipped."
          ],
          "permalink": "summaries/2025-09-12-crypto-daily-update-12-09-2025-b00m-sol-taking-off-the-july-102d-247-target-expl.html"
        },
        {
          "title": "Crypto Daily Update | 11/09/2025 - Does BTC want it's strength back?",
          "datePT": "2025-09-11",
          "url": "https://youtu.be/RP6Bl1j9DD4",
          "videoId": "RP6Bl1j9DD4",
          "bullets": [
            "Transcript unavailable — summary skipped."
          ],
          "permalink": "summaries/2025-09-11-crypto-daily-update-11-09-2025-does-btc-want-it-s-strength-back.html"
        },
        {
          "title": "Crypto Daily Update | 10/09/2025 - Price in a tricky spot.",
          "datePT": "2025-09-10",
          "url": "https://youtu.be/fe2XcCzIkEQ",
          "videoId": "fe2XcCzIkEQ",
          "bullets": [
            "Transcript unavailable — summary skipped."
          ],
          "permalink": "summaries/2025-09-10-crypto-daily-update-10-09-2025-price-in-a-tricky-spot.html"
        },
        {
          "title": "Crypto Daily Close Update | 09/09/2025 - SOL vs BTC - Crazy Times - Lots of closes today.",
          "datePT": "2025-09-09",
          "url": "https://youtu.be/xTl__X95QrU",
          "videoId": "xTl__X95QrU",
          "bullets": [
            "Transcript unavailable — summary skipped."
          ],
          "permalink": "summaries/2025-09-09-crypto-daily-close-update-09-09-2025-sol-vs-btc-crazy-times-lots-of-closes-today.html"
        },
        {
          "title": "Crypto Daily Close Update | 08/09/2025 - Prime Day Part 1",
          "datePT": "2025-09-08",
          "url": "https://youtu.be/GLBUc5roBMk",
          "videoId": "GLBUc5roBMk",
          "bullets": [
            "Transcript unavailable — summary skipped."
          ],
          "permalink": "summaries/2025-09-08-crypto-daily-close-update-08-09-2025-prime-day-part-1.html"
        },
        {
          "title": "Crypto Daily Close Update | 7/09/2025 - Long one - Lots to cover - BTC Should Give a big Move Soon.",
          "datePT": "2025-09-07",
          "url": "https://youtu.be/21_2d0AQi9A",
          "videoId": "21_2d0AQi9A",
          "bullets": [
            "Transcript unavailable — summary skipped."
          ],
          "permalink": "summaries/2025-09-07-crypto-daily-close-update-7-09-2025-long-one-lots-to-cover-btc-should-give-a-big.html"
        },
        {
          "title": "Crypto Daily Update | 06/09/2025 - Sunday Pump or Sunday Dump? (Or both!)",
          "datePT": "2025-09-06",
          "url": "https://youtu.be/nVPoWOlHtXU",
          "videoId": "nVPoWOlHtXU",
          "bullets": [
            "Transcript unavailable — summary skipped."
          ],
          "permalink": "summaries/2025-09-06-crypto-daily-update-06-09-2025-sunday-pump-or-sunday-dump-or-both.html"
        },
        {
          "title": "Quick Update - Thoughts on the 3D close for tomorrow - More down? - Or recovery?",
          "datePT": "2025-09-05",
          "url": "https://youtu.be/IuEZH56b0Dk",
          "videoId": "IuEZH56b0Dk",
          "bullets": [
            "Transcript unavailable — summary skipped."
          ],
          "permalink": "summaries/2025-09-05-quick-update-thoughts-on-the-3d-close-for-tomorrow-more-down-or-recovery.html"
        },
        {
          "title": "Crypto Daily Update | 05/09/2025 - Another day on the cliff.",
          "datePT": "2025-09-05",
          "url": "https://youtu.be/PFrfBG5nc_w",
          "videoId": "PFrfBG5nc_w",
          "bullets": [
            "Transcript unavailable — summary skipped."
          ],
          "permalink": "summaries/2025-09-05-crypto-daily-update-05-09-2025-another-day-on-the-cliff.html"
        },
        {
          "title": "Crypto Daily Update | 04/09/2025 - Market seems bored. Move soon.",
          "datePT": "2025-09-04",
          "url": "https://youtu.be/a1SZEXkPKYo",
          "videoId": "a1SZEXkPKYo",
          "bullets": [
            "Transcript unavailable — summary skipped."
          ],
          "permalink": "summaries/2025-09-04-crypto-daily-update-04-09-2025-market-seems-bored-move-soon.html"
        },
        {
          "title": "Crypto Daily Close Update | 3/09/2025 - Calm.. Storm?",
          "datePT": "2025-09-03",
          "url": "https://youtu.be/BRinEOh_k4A",
          "videoId": "BRinEOh_k4A",
          "bullets": [
            "Transcript unavailable — summary skipped."
          ],
          "permalink": "summaries/2025-09-03-crypto-daily-close-update-3-09-2025-calm-storm.html"
        },
        {
          "title": "Crypto Daily Close Update | 02/09/2025 - Is the bottom in?",
          "datePT": "2025-09-02",
          "url": "https://youtu.be/l2_aXap6cog",
          "videoId": "l2_aXap6cog",
          "bullets": [
            "Transcript unavailable — summary skipped."
          ],
          "permalink": "summaries/2025-09-02-crypto-daily-close-update-02-09-2025-is-the-bottom-in.html"
        },
        {
          "title": "Crypto Daily Close Update | 01/09/2025 - More Flush? Temp Bounce? Do they want 85k BTC?",
          "datePT": "2025-09-01",
          "url": "https://youtu.be/inYpkBVe7TU",
          "videoId": "inYpkBVe7TU",
          "bullets": [
            "Transcript unavailable — summary skipped."
          ],
          "permalink": "summaries/2025-09-01-crypto-daily-close-update-01-09-2025-more-flush-temp-bounce-do-they-want-85k-btc.html"
        },
        {
          "title": "Crypto Daily Close Update | 31/08/2025 - Flush Soon",
          "datePT": "2025-08-31",
          "url": "https://youtu.be/88Rbd8G7ytA",
          "videoId": "88Rbd8G7ytA",
          "bullets": [
            "Transcript unavailable — summary skipped."
          ],
          "permalink": "summaries/2025-08-31-crypto-daily-close-update-31-08-2025-flush-soon.html"
        },
        {
          "title": "Crypto Daily Close Update | 30/08/2025 - What are they building for?",
          "datePT": "2025-08-30",
          "url": "https://youtu.be/ykJQpj6X-K4",
          "videoId": "ykJQpj6X-K4",
          "bullets": [
            "Transcript unavailable — summary skipped."
          ],
          "permalink": "summaries/2025-08-30-crypto-daily-close-update-30-08-2025-what-are-they-building-for.html"
        },
        {
          "title": "Crypto Daily Close Update | 29/08/2025 - Prime Day Flush - Is it over?",
          "datePT": "2025-08-29",
          "url": "https://youtu.be/vtu2PBFjewU",
          "videoId": "vtu2PBFjewU",
          "bullets": [
            "Transcript unavailable — summary skipped."
          ],
          "permalink": "summaries/2025-08-29-crypto-daily-close-update-29-08-2025-prime-day-flush-is-it-over.html"
        },
        {
          "title": "SOL BTC Update | 28/08/2025 - Observations on all closes today.",
          "datePT": "2025-08-28",
          "url": "https://youtu.be/r5bGg4SITkU",
          "videoId": "r5bGg4SITkU",
          "bullets": [
            "Transcript unavailable — summary skipped."
          ],
          "permalink": "summaries/2025-08-28-sol-btc-update-28-08-2025-observations-on-all-closes-today.html"
        },
        {
          "title": "Crypto Daily Close Update | 28/08/2025 - Many Big Closes Today & Prime Day Tomorrow! - Chaos?",
          "datePT": "2025-08-28",
          "url": "https://youtu.be/z1HNYsntq84",
          "videoId": "z1HNYsntq84",
          "bullets": [
            "Transcript unavailable — summary skipped."
          ],
          "permalink": "summaries/2025-08-28-crypto-daily-close-update-28-08-2025-many-big-closes-today-prime-day-tomorrow-ch.html"
        },
        {
          "title": "Crypto Daily Close Update | 27/08/2025 - Prime Day 1D TV & 2D Exchange close",
          "datePT": "2025-08-27",
          "url": "https://youtu.be/e_VlYkf_6RI",
          "videoId": "e_VlYkf_6RI",
          "bullets": [
            "Transcript unavailable — summary skipped."
          ],
          "permalink": "summaries/2025-08-27-crypto-daily-close-update-27-08-2025-prime-day-1d-tv-2d-exchange-close.html"
        },
        {
          "title": "SOL BTC Update | 26/08/2025 - Observations on the closes today",
          "datePT": "2025-08-26",
          "url": "https://youtu.be/epmSojHqMzI",
          "videoId": "epmSojHqMzI",
          "bullets": [
            "Transcript unavailable — summary skipped."
          ],
          "permalink": "summaries/2025-08-26-sol-btc-update-26-08-2025-observations-on-the-closes-today.html"
        },
        {
          "title": "Crypto Daily Close Update | 26/08/2025 - Bitcoin Crash? SOL Pump?",
          "datePT": "2025-08-26",
          "url": "https://youtu.be/nX6hZjiCxUU",
          "videoId": "nX6hZjiCxUU",
          "bullets": [
            "Transcript unavailable — summary skipped."
          ],
          "permalink": "summaries/2025-08-26-crypto-daily-close-update-26-08-2025-bitcoin-crash-sol-pump.html"
        },
        {
          "title": "SOL BTC Update | 24/08/2025 - Quick Observation of Close",
          "datePT": "2025-08-24",
          "url": "https://youtu.be/qmhKBUovO4Q",
          "videoId": "qmhKBUovO4Q",
          "bullets": [
            "Transcript unavailable — summary skipped."
          ],
          "permalink": "summaries/2025-08-24-sol-btc-update-24-08-2025-quick-observation-of-close.html"
        },
        {
          "title": "SOL BTC Update | 23/08/2025 - Quick Overview of how the 1D Closed",
          "datePT": "2025-08-23",
          "url": "https://youtu.be/rgOPNzqCeBE",
          "videoId": "rgOPNzqCeBE",
          "bullets": [
            "So we could see a rejection off that trend. um maybe a sweep to grab liquidity then a rejection within the sort of the next 24 hours but that's definitely mo…",
            "It could dump first then pump back up or it could go up hit one of these um rejection levels like anything from basically anything from the trend around 116 …",
            "Uh it'll pull back up above the trend within 5 days then continue up to test these levels or it could go up first and then down."
          ],
          "permalink": "summaries/2025-08-23-sol-btc-update-23-08-2025-quick-overview-of-how-the-1d-closed.html"
        },
        {
          "title": "SOL BTC Update - Observations of the close - 22/08/2025",
          "datePT": "2025-08-22",
          "url": "https://youtu.be/AkbLexK-O8g",
          "videoId": "AkbLexK-O8g",
          "bullets": [
            "Um but if we did get some kind of big final flush um over the weekend um this really has the ability to even if it doesn't actually hard close this top one i…",
            "Um, we're still above the trend, so we could go down, maybe reject down to 113 and then bounce up and take all that liquidity, which which by then there ther…",
            "It's it's really the the fallover and retest of the trend would start after the hard close of it. um or it would be right towards the end of its time frame t…"
          ],
          "permalink": "summaries/2025-08-22-sol-btc-update-observations-of-the-close-22-08-2025.html"
        },
        {
          "title": "Crypto Daily Close Update | 22/08/2025 - We pumped - Now Pullback?",
          "datePT": "2025-08-22",
          "url": "https://youtu.be/Q_-rR0tkMTc",
          "videoId": "Q_-rR0tkMTc",
          "bullets": [
            "Um there's potentially some kind of push that might come up into that 120 area, but um uh yeah, but there's there's some things happening at today's close th…",
            "So, um and I think what what um what we're going to see on BTC um I think might might actually be the thing that triggers a bit of a pullback. um 30-day uh a…",
            "So, if we can close down here in the next 2 hours, uh then you possibly expect a break um a break retest, which which might bring us back up to 65 um or we c…"
          ],
          "permalink": "summaries/2025-08-22-crypto-daily-close-update-22-08-2025-we-pumped-now-pullback.html"
        },
        {
          "title": "Crypto Daily Close Update | 21/08/2025 - Prime Day!",
          "datePT": "2025-08-21",
          "url": "https://youtu.be/MmiNxEK5vqI",
          "videoId": "MmiNxEK5vqI",
          "bullets": [
            "Uh, as far as SOL, um, sort of revisiting 185 as a bit of a cluster or revisiting something up to say 191, um, would be actually bullish if they go to 191 be…",
            "And if it does open sort of where it is now at about 1697, then it it will bounce down to retest one of these hold levels or um one of these origin levels or…",
            "Now if we look at uh Bitcoin dominance stable dominance um the rejection is still in play uh it is sitting above the trend and so for there to be a pump on a…"
          ],
          "permalink": "summaries/2025-08-21-crypto-daily-close-update-21-08-2025-prime-day.html"
        },
        {
          "title": "Crypto Daily Close Update | 20/08/2025 - SOL Strong, BTC Weak - Do we buy the dip?",
          "datePT": "2025-08-20",
          "url": "https://youtu.be/k5f121SpRfg",
          "videoId": "k5f121SpRfg",
          "bullets": [
            "But either way that liquidity is looking a bit bit sketchy on um SOL and definitely we could see a swipe in both directions on BTC. they're really really out…",
            "So I would be thinking that um if this does take a dip back to trend, if it does take AA dip back to um the hold level even um I mean realistically a closeup…",
            "It's um and then if BTC does do that dive to 110, first time I'm going to say this, but maybe we do not see those 150s, we might just bounce from the 170s at…"
          ],
          "permalink": "summaries/2025-08-20-crypto-daily-close-update-20-08-2025-sol-strong-btc-weak-do-we-buy-the-dip.html"
        },
        {
          "title": "Crypto Daily Close Update 19/08/2025 - End signs for Dump, Or more pain?",
          "datePT": "2025-08-19",
          "url": "https://youtu.be/tZnNZ1ZCKyY",
          "videoId": "tZnNZ1ZCKyY",
          "bullets": [
            "So there's good good and bad about that. like having a slow grind down enables people to start to open more and more shorts as the price goes down, which whi…",
            "So, uh, all these all these shorts on BTC, you know, 100x shorts from 113 through to about 116, um, they're just all opening up, you know, on the lower time …",
            "Um, but it all comes down to where it closes like yesterday. um we get to the SOL charts, you'll note I sent a tweet out yesterday saying if it closes under …"
          ],
          "permalink": "summaries/2025-08-19-crypto-daily-close-update-19-08-2025-end-signs-for-dump-or-more-pain.html"
        },
        {
          "title": "Crypto Daily Close Update | 18/08/2025 - Will We Get Dump Day #2 ?",
          "datePT": "2025-08-18",
          "url": "https://youtu.be/Y9VjCdoQ8as",
          "videoId": "Y9VjCdoQ8as",
          "bullets": [
            "There is deeper than that, you know, available on some bigger time frames, but um particularly people who entered on the monthly um trades um a while ago and…",
            "Uh it is a daily level and we do have a couple hours left. um if they want to induce more shorts then I guess staying flat for now is not such a bad thing bu…",
            "And that's giving um that's what's giving us basically this little bit of a bounce back on things like SOL where we've bounced off those um uh 179 levels."
          ],
          "permalink": "summaries/2025-08-18-crypto-daily-close-update-18-08-2025-will-we-get-dump-day-2.html"
        },
        {
          "title": "Crypto Daily Close Update | 17/08/2025 - The Big Multi-Week Closes are TODAY!",
          "datePT": "2025-08-17",
          "url": "https://youtu.be/bATL6S0Fgxc",
          "videoId": "bATL6S0Fgxc",
          "bullets": [
            "Uh, there's, um, there is that small area that's starting to form uh, up around um, 210 to 213 that has confluence with some of the higher um, level rejectio…",
            "Um and our monthly levels here at 102 and of course everything else in between um 116 uh is quite a key level there'SA lot of 100 100x leverage sitting there…",
            "Either either way, the the strength that this is sort of showing given that it's rejected off the daily origin level, um the strength that it's showing reall…"
          ],
          "permalink": "summaries/2025-08-17-crypto-daily-close-update-17-08-2025-the-big-multi-week-closes-are-today.html"
        },
        {
          "title": "Crypto Daily Close Update | 16/08/2025 - BTC Dump? - SOL might be forced to follow.",
          "datePT": "2025-08-16",
          "url": "https://youtu.be/I1H08WyN9Gk",
          "videoId": "I1H08WyN9Gk",
          "bullets": [
            "Uh where the lows would sort of be um short-term lows would would be down to say the 170s and um short-term highs um up to you know about 196 195 sort of area.",
            "Uh for SOL, um it's showing sort of up to about that 202 area as a cluster for um uh liquidity on the 7day.",
            "Um, SOL that means pushing up to about 213 uh to take everything to the top side or down to sort of about 163 um to take everything to the bottom side."
          ],
          "permalink": "summaries/2025-08-16-crypto-daily-close-update-16-08-2025-btc-dump-sol-might-be-forced-to-follow.html"
        },
        {
          "title": "Crypto Daily Close Update 15/08/2025 - A slow prime day? What are they planning?",
          "datePT": "2025-08-15",
          "url": "https://youtu.be/xl3MMN2pOco",
          "videoId": "xl3MMN2pOco",
          "bullets": [
            "Um, I'll show you something on the weekly later that just sort of suggests that there's really it's at a point now where it's got to go lower if it wants to …",
            "Um if it went to the top side of all this it would it would sort of be up to about that 125 mark but um most of that liquidity would be gone you know by the …",
            "Uh as far as the um BTC USD um or stables risk uh risk assets um it's bouncing off that trend exactly as we thought it would."
          ],
          "permalink": "summaries/2025-08-15-crypto-daily-close-update-15-08-2025-a-slow-prime-day-what-are-they-planning.html"
        },
        {
          "title": "Crypto Daily Close Update | 14/08/2025 - Flush + Prime Day Tomorrow - Maybe a top for BTC?",
          "datePT": "2025-08-14",
          "url": "https://youtu.be/QmsY9Lbjy-I",
          "videoId": "QmsY9Lbjy-I",
          "bullets": [
            "No real reason to go above 125 as far as um Bitcoin goes. and on SOL uh they're showing up to sort of 213 214 and and right down to that 153 area which um is…",
            "So yesterday um and today so closing today we only have a 1 day and a two-day close and a 113 day which we will look at but um it's so it's very very similar…",
            "But um if you enter on one of these and you and you take some profits uh when it hits that sort of 190 area um and then you just set yourself AA stop loss ei…"
          ],
          "permalink": "summaries/2025-08-14-crypto-daily-close-update-14-08-2025-flush-prime-day-tomorrow-maybe-a-top-for-bt.html"
        },
        {
          "title": "Crypto Daily Close Update | 13/08/2025 - Bullish Looking Charts - But is it a Trap?",
          "datePT": "2025-08-13",
          "url": "https://youtu.be/t8EDt0NhJaI",
          "videoId": "t8EDt0NhJaI",
          "bullets": [
            "So if they're trying to induce people to open longs by looking super bullish, um it's quite cheap to do it at the moment. they can just keep bidding it up, b…",
            "Um but at the moment they're still pushing up into that higher liquidity which sort of ranges up to about 124k or on um SOL sort of ranges up to about um 206…",
            "Um yeah, if they are going to sweep that lower liquidity, you'll probably find that that just pulls back up in the next 50 odd minutes and closes above. uh a…"
          ],
          "permalink": "summaries/2025-08-13-crypto-daily-close-update-13-08-2025-bullish-looking-charts-but-is-it-a-trap.html"
        },
        {
          "title": "Crypto Daily Close Update | 12/08/2025 - BTC Down, SOL Up, Alt Season Finally? - Or another trap?",
          "datePT": "2025-08-12",
          "url": "https://youtu.be/mVEOgDYmVEs",
          "videoId": "mVEOgDYmVEs",
          "bullets": [
            "Um, it's, uh, there's another sort of way you can view this, um, which at least sort of shows you a wee bit about how it's changed, uh, which is this.",
            "Uh so all these people that are down here um they might be feeling safe but it really doesn't take much particularly if BTC was to do a bit of a spike up and…",
            "It's it this was the trade from yesterday which was taking this interior um range well it's actually a range trend but taking this range trend and taking it …"
          ],
          "permalink": "summaries/2025-08-12-crypto-daily-close-update-12-08-2025-btc-down-sol-up-alt-season-finally-or-anoth.html"
        },
        {
          "title": "Crypto Daily Close Update | 11/08/2025 - Happy Prime Day!",
          "datePT": "2025-08-11",
          "url": "https://youtu.be/daml8YKSlzI",
          "videoId": "daml8YKSlzI",
          "bullets": [
            "SOL's going to find a level of support and once it hits that level of support it's probably going to be quite sticky whereas BTC might still actually push fu…",
            "Um, and uh, as long as the price of course gets realigned with where they want it to be um, before the end of tomorrow's close, then there isn't really any m…",
            "Um, but not just that, you also get the ability to stay down at those prices for a while, which is a whole another psychological issue because if if someone'…"
          ],
          "permalink": "summaries/2025-08-11-crypto-daily-close-update-11-08-2025-happy-prime-day.html"
        },
        {
          "title": "Crypto Daily Close Update | 10/08/2025 - Also Weekly Close",
          "datePT": "2025-08-10",
          "url": "https://youtu.be/EsVIZa01bOs",
          "videoId": "EsVIZa01bOs",
          "bullets": [
            "Uh likewise uh up there to sort of that 188 area um maybe a little higher uh if they were to push up on SOL and BTC seems to be down to about 115 and up to 1…",
            "Uh and then then of course it would look extremely imbalanced to the other side and that's when uh those targets down at 150, 150 uh six etc. about all that …",
            "So, over to SOL. uh one day SOL if it stays where it is in the next um hour and 45 for the next hour and 45 minutes it's going to move um the interior trend …"
          ],
          "permalink": "summaries/2025-08-10-crypto-daily-close-update-10-08-2025-also-weekly-close.html"
        },
        {
          "title": "Crypto Daily Close Update | 09/08/2025 - HTF still in play. Possible rejection into next week.",
          "datePT": "2025-08-09",
          "url": "https://youtu.be/lbMdEDn_oQc",
          "videoId": "lbMdEDn_oQc",
          "bullets": [
            "Um, if we have a look at the 1day liquidity, uh, 1day liquidity, and this is this is a pretty important one, just in case we're trying to think about, you kn…",
            "So, SOL Bitcoin, um, there's not that many closes today, structural closes, but SOL Bitcoin has hit that rejection level that we had marked out there, uh, hi…",
            "So this if it if it was already very very much overextended um on the daily back here on the 7th and it's retraced to create a trend uh on the 8th and now it…"
          ],
          "permalink": "summaries/2025-08-09-crypto-daily-close-update-09-08-2025-htf-still-in-play-possible-rejection-into-n.html"
        },
        {
          "title": "Crypto Daily Close Update | 08/08/2025",
          "datePT": "2025-08-08",
          "url": "https://youtu.be/BXLgIWPKID4",
          "videoId": "BXLgIWPKID4",
          "bullets": [
            "So, and when we look at uh our 5day um we're going to get a interior trend um on our 5day for the first time, which is that and it's also a range trend aroun…",
            "So, these types of things normally create some form of um retest. it'll probably reject off um something in in this area that it's roughly in now if if not t…",
            "There's there's nothing there's nothing in there really that's actually proper support until we get back to that um 114 trend that's been running through there."
          ],
          "permalink": "summaries/2025-08-08-crypto-daily-close-update-08-08-2025.html"
        },
        {
          "title": "Crypto Daily Close Update | 07/08/2025",
          "datePT": "2025-08-07",
          "url": "https://youtu.be/lo71-IfbBvQ",
          "videoId": "lo71-IfbBvQ",
          "bullets": [
            "Um, but at this stage it's kind of hard because the next rejection in theory should come somewhere between 180 and 187 and there's two different trends to lo…",
            "It's it's more likely once this breaks out that it's going to want to try and head up um to one of the upper trends.",
            "The two-day obviously hasn't closed yet and still has another day to go on it, but as you can see, it's really just overextended um through the two-day trend…"
          ],
          "permalink": "summaries/2025-08-07-crypto-daily-close-update-07-08-2025.html"
        },
        {
          "title": "Crypto Daily Close Update | 06/08/2025",
          "datePT": "2025-08-06",
          "url": "https://youtu.be/Utr66b4azt0",
          "videoId": "Utr66b4azt0",
          "bullets": [
            "They're trying to get people to take out long positions because they've already got pretty decent liquidity um to the upside. the numbers that are sort of sh…",
            "So, it's still got support, but if it does push up, it's probably from this level, if it does push up, it's really going to at most sort of get to this um 00…",
            "As it currently stands, it'SA really indecisive um candle, you know, so kind of like a dogee with a bit of a body on it, but it's decent wicks to the upside …"
          ],
          "permalink": "summaries/2025-08-06-crypto-daily-close-update-06-08-2025.html"
        },
        {
          "title": "Crypto Daily Close Update | 05/08/2025",
          "datePT": "2025-08-05",
          "url": "https://youtu.be/fHa-5BkRBco",
          "videoId": "fHa-5BkRBco",
          "bullets": [
            "Even though the liquidity just doesn't seem to line up with that at this stage, but um if they did a bit of a pump first and some more longs came in, that wo…",
            "For now, it's sort of indicating based on where it's closing that it might dive down, grab liquidity, go up, or it might bounce. but it's um uh it's not real…",
            "So that's sort of implying BTC wants to break down whereas SOL is not creating a hold level on the same time frame at at this stage but unless it was to drop…"
          ],
          "permalink": "summaries/2025-08-05-crypto-daily-close-update-05-08-2025.html"
        },
        {
          "title": "Crypto Daily Close Update | 04/08/2025",
          "datePT": "2025-08-04",
          "url": "https://youtu.be/vcEEF_e1uhg",
          "videoId": "vcEEF_e1uhg",
          "bullets": [
            "Um, as far as strength of safety assets versus uh normal um risk assets, uh you can see we've pulled back down under that 3-day uh and we're heading back dow…",
            "Um, and it's still got untested levels down here, 110 and 109 things that um, it realistically should go down and retest those.",
            "It's it's bouncing off whatever was the time frame at the backside of um this area here when it sort of bounced off that 111 mark and that's now creating the…"
          ],
          "permalink": "summaries/2025-08-04-crypto-daily-close-update-04-08-2025.html"
        },
        {
          "title": "Crypto Daily Close Update | 3/08/2025 - Also Weekly Closes Today",
          "datePT": "2025-08-03",
          "url": "https://youtu.be/JN1VvAvwdRg",
          "videoId": "JN1VvAvwdRg",
          "bullets": [
            "Uh we've got um heavy shorts, you know, when you when you look on on BTC, we've got heavy shorts if you look at 7-day positions and also quite a lot of short…",
            "So, I'm thinking that uh and I'll show you in the charts the confluence of this later, but I'm thinking that we're going to see that sort of 170 to 175 range…",
            "Uh, but it's going to open from a position unless it unless it does get back up over it would have to get back up over about 1 or 0.00145 and open on the oth…"
          ],
          "permalink": "summaries/2025-08-03-crypto-daily-close-update-3-08-2025-also-weekly-closes-today.html"
        },
        {
          "title": "Crypto Daily Close Update 1/08/2025 - Dump Day!",
          "datePT": "2025-08-01",
          "url": "https://youtu.be/4odvd853L94",
          "videoId": "4odvd853L94",
          "bullets": [
            "Um, as far as what that's done to liquidity, um, I hate to say it, but I think BTC's probably still got some more downside that it's that it's going to go ca…",
            "Um as far as relative support, uh it's basically dived straight through the um retest of the break level there and heading heading down to um heading down to…",
            "Um, it's actually there'll be another chart soon, but it's actually on I think just bouncing on a weekly trend at the moment, but um these are pretty big lev…"
          ],
          "permalink": "summaries/2025-08-01-crypto-daily-close-update-1-08-2025-dump-day.html"
        },
        {
          "title": "Crypto Daily Close Update | 31/07/2025 - Monthly Close",
          "datePT": "2025-07-31",
          "url": "https://youtu.be/GqwoccFxAgk",
          "videoId": "GqwoccFxAgk",
          "bullets": [
            "Um so to start with uh our 30-day liquidity um we've got uh still more longs on BTC. people have gone a little bit more towards the shorts on on SOL for the …",
            "Uh and if we look at one day um you can see a much greater you know everyone's very bearish which is more to say that people were very very bullish but they'…",
            "So next one's going to open underneath. potentially there'll be some resistance and and it's very likely we'll come back down and test this 110 um probably p…"
          ],
          "permalink": "summaries/2025-07-31-crypto-daily-close-update-31-07-2025-monthly-close.html"
        },
        {
          "title": "Crypto Daily Close Update | 30/07/2025 - Happy Prime Day!",
          "datePT": "2025-07-30",
          "url": "https://youtu.be/UG4OkXywvms",
          "videoId": "UG4OkXywvms",
          "bullets": [
            "Um, I think there's still some stuff in play which um should, you know, should definitely go see those 150s um before any kind of major spin around could hap…",
            "Um if we start to look at the 7-day uh you can see definitely more shorts, less longs and a lot of that is obviously because the longs now um on SOL particul…",
            "But um for now it can keep diving down if it wants to come down here, hit the hold level and uh that would sort of line up with everything else that's going …"
          ],
          "permalink": "summaries/2025-07-30-crypto-daily-close-update-30-07-2025-happy-prime-day.html"
        }
      ]
    },
    {
      "title": "Education",
      "items": [
        {
          "title": "Education - Are we in a weekly Bear Market on SOL? - Origin Levels",
          "datePT": "2025-09-26",
          "url": "https://youtu.be/ImbLJhq1KpY",
          "videoId": "ImbLJhq1KpY",
          "bullets": [
            "So, it's not it's not a very clean origin level and it's got that silly little silly little dogee in there.",
            "And the other one, which would be this level, and like I said, it's very, very dirty dirty level, this one, because it's got these candles above it, but they…",
            "I think overall what's happening is we're compressing into this area on the weekly and we're going to either come out over the top of this or maybe even up o…"
          ],
          "permalink": "summaries/2025-09-26-education-are-we-in-a-weekly-bear-market-on-sol-origin-levels.html"
        },
        {
          "title": "Education - TA By Request - $NOS - Nosana",
          "datePT": "2025-09-20",
          "url": "https://youtu.be/c9Nyy_P9EMo",
          "videoId": "c9Nyy_P9EMo",
          "bullets": [
            "So, so to be absolutely realistic, um the token kind of lives in this area at the moment and you know if it if it was to push up abovexum cuz it's it has…",
            "Yeah, it's it's not um hasn't really been through that much accumulation down here um at this price point.",
            "Um if you've if you've got a position that's all the way up here in that xyou know, xorxprice point, then there'SA lot of things this has to get throu…"
          ],
          "permalink": "summaries/2025-09-20-education-ta-by-request-nos-nosana.html"
        },
        {
          "title": "Education - TA by Request - $SEI - Looks good for a move.",
          "datePT": "2025-09-14",
          "url": "https://youtu.be/BUzZ7wYL2Qc",
          "videoId": "BUzZ7wYL2Qc",
          "bullets": [
            "Transcript unavailable — summary skipped."
          ],
          "permalink": "summaries/2025-09-14-education-ta-by-request-sei-looks-good-for-a-move.html"
        },
        {
          "title": "Education - By Request - HTF Charting of $TSLA - General Differences for Stocks.",
          "datePT": "2025-09-12",
          "url": "https://youtu.be/8LaOuzVbLo4",
          "videoId": "8LaOuzVbLo4",
          "bullets": [
            "Transcript unavailable — summary skipped."
          ],
          "permalink": "summaries/2025-09-12-education-by-request-htf-charting-of-tsla-general-differences-for-stocks.html"
        },
        {
          "title": "Education - TA by Request - $TSLA - Future looks very bullish",
          "datePT": "2025-09-12",
          "url": "https://youtu.be/CLo3EEe7Dbw",
          "videoId": "CLo3EEe7Dbw",
          "bullets": [
            "Transcript unavailable — summary skipped."
          ],
          "permalink": "summaries/2025-09-12-education-ta-by-request-tsla-future-looks-very-bullish.html"
        },
        {
          "title": "Education - TA by Request - $HYPE - So new, is it a trap? or just early?",
          "datePT": "2025-09-12",
          "url": "https://youtu.be/9rlkYWN3TWo",
